Name,SOS#,Assn Type,# of Units,Telephone,Address1,Address2,City,State,Zip Code,County,Firm_Normalized,Firm_Final,Firm_ByPhone,Firm_ByAddress,Address2_Normalized,Name_Changed_Flag
SABLE CREEK HOMEOWNERS ASSOCIATION,0683582005-2,REG,60,(702) 362-6262,C/O TERRA WEST MANAGEMENT SERVICES,PO BOX 80900,LAS VEGAS,NV,89180,Clark,real propertie management group,real propertie management group,real propertie management group,real propertie management group,po box 95606,False
SABLE OAKS HOMEOWNERS ASSOCIATION,10333-2003,REG,31,(702) 795-1740,C/O SHANNON DAY PROPERTY MANAGEMENT,PO BOX 97512,LAS VEGAS,NV,89193,Clark,pinnacle community association management,pinnacle community association management,pinnacle community association management,pinnacle community association management,8311 w sunset rd,False
SABLE OAKS MANOR HOMEOWNERS ASSOCIATION,0227452005-5,REG,38,(702) 835-6904,C/O THE MANAGEMENT TRUST,8485 W SUNSET RD STE. 100,LAS VEGAS,NV,89113,Clark,camco,camco,camco,camco,po box 400815,False
SADDLE PEAK AT NEVADA TRAILS COMMUNITY ASSOCIATION,2663-2002,SUB,328,(702) 737-8580,C/O FIRSTSERVICE RESIDENTIAL NEVADA LLC,8290 ARVILLE ST,LAS VEGAS,NV,89139,Clark,firstservice residential nevada,firstservice residential nevada,firstservice residential nevada,firstservice residential nevada,8290 arville st,False
SADDLE RIDGE UNIT OWNERS ASSOCIATION,0069532007-5,SUB,66,(775) 853-9777,C/O TERRA WEST PROPERTY MANAGEMENT,10651 PROFESSIONAL CIR STE A,RENO,NV,89521,Washoe,firstservice residential nevada,firstservice residential nevada,firstservice residential nevada,firstservice residential nevada,8290 arville st,False
SADDLEHORN HOMEOWNERS' ASSOCIATION,3827-1989,REG,432,(775) 323-4355,"C/O GASTON WILKERSON ASSOCIATION SERVICES, INC.",4751 CAUGHLING PKWY STE B,RENO,NV,89519,Washoe,camco,camco,camco,camco,po box 400518,False
SADDLERIDGE HOMEOWNERS ASSOCIATION,0425412005-1,REG,88,(702) 655-7064,C/O LAS VEGAS VALLEY COMMUNITY MANAGEMENT,7571 TULE SPRINGS RD,LAS VEGAS,NV,89131,Clark,colonial property management,colonial property management,colonial property management,colonial property management,8595 s eastern ave,False
SADIE ESTATES HOMEOWNERS ASSOCIATION,0548112011-1,REG,13,(702) 942-2500,C/O COMMUNITY MANAGEMENT GROUP,2450 BOX CANYON DR,LAS VEGAS,NV,89102,Clark,harmony management,harmony management,harmony management,harmony management,2300 w sahara ave,False
SAFARI HOMEOWNERS ASSOCIATION,4623-1996,REG,91,(702) 990-9707,C/O HOA MANAGEMENT,6595 W SMOKE RANCH STE 110,LAS VEGAS,NV,89108,Clark,the management trust,the management trust,the management trust,the management trust,8485 w sunset rd,False
SAGE CANYON HOMEOWNERS ASSOCIATION,0500222015-2,REG,77,(702) 942-2500,C/O COMMUNITY MANAGEMENT GROUP,2450 BOX CANYON DR,LAS VEGAS,NV,89128,Clark,colonial property management,colonial property management,colonial property management,colonial property management,8595 s eastern ave,False
SAGE CREEK 1 HOMEOWNERS ASSOCIATION,0401752006-4,REG,58,(702) 564-2909,C/O JMARKUS HOA MANAGEMENT,1000 S BOULDER HWY,HENDERSON,NV,89015,Clark,firstservice residential nevada,firstservice residential nevada,firstservice residential nevada,firstservice residential nevada,639 isbell rd,False
SAGE CREEK AT BRUCE HOMEOWNERS' ASSOCIATION,0678462007-3,REG,58,(702) 531-3382,C/O CAMCO,PO BOX 400518,LAS VEGAS,NV,89140,Clark,eugene burger management,eugene burger management,eugene burger management,eugene burger management,5011 meadowood mall way,False
SAGE HILLS COMMUNITY ASSOCIATION,15491-2002,SUB,90,(702) 754-6313,C/O SIERRA COMMUNITY MANAGEMANT,6280 S VALLEY VIEW DR STE 310,LAS VEGAS,NV,89118,Clark,community management group,community management group,community management group,community management group,2450 box canyon dr,False
SAGE LAKE PROPERTY OWNER'S ASSOCIATION,0046222013-9,MSTR,22,(775) 385-0422,,PO BOX 8476T,SPRING CREEK,NV,89815,Elko,,,,,,
SAGECREEK HOMEOWNERS ASSOCIATION,21381-1996,REG,230,(702) 531-3382,C/O CAMCO,PO BOX 400518,LAS VEGAS,NV,89140,Clark,camco,camco,camco,camco,po box 400518,False
SAHARA MOUNTAIN VISTA HOMEOWNERS ASSOCIATION,491-1997,REG,176,(702) 737-8580,"C/O FIRSTSERVICE RESIDENTIAL, NEVADA, LLC",8290 ARVILLE ST,LAS VEGAS,NV,89139,Clark,taylor association management,taylor association management,taylor association management,taylor association management,259 n peco rd,False
SAHARA SUMMIT HOMEOWNERS ASSOCIATION,1114-1999,REG,160,(702) 531-3382,C/O CAMCO,PO BOX 400518,LAS VEGAS,NV,89140,Clark,new valley real estate management,new valley real estate management,new valley real estate management,new valley real estate management,1664 us hwy 395n,False
SAHARA SUNRISE HOMEOWNERS ASSOCIATION,8666-2000,REG,212,(702) 531-3382,C/O CAMCO,PO BOX 400518,LAS VEGAS,NV,89140,Clark,camco,camco,camco,camco,po box 400518,False
SAINT ELMO CIRCLE HOMEOWNERS ASSOCIATION,24095-2004,REG,8,(702) 260-6763,,235 SAINT ELMO CIRCLE,LAS VEGAS,NV,89123,Clark,,,,,,
SALERNO @ ALIANTE,SAME AS MASTER,SAM,126,(702) 638-7770,"C/O FIRSTSERVICE RESIDENTIAL, NEVADA, LLC",8920 ARVILLE ST,LAS VEGAS,NV,89139,Clark,community management group,community management group,community management group,community management group,2450 box canyon dr,False
SALERNO ESTATES HOMEOWNERS ASSOCIATION,0348902013-6,REG,23,(702) 531-3382,C/O CAMCO,PO BOX 400518,LAS VEGAS,NV,89140,Clark,equu management group,equu management group,equu management group,equu management group,5480 reno corporate dr,False
SALT CREEK OWNERS ASSOCIATION,31988-1999,REG,80,(702) 655-7064,C/O LAS VEGAS VALLEY COMMUNITY MANAGEMENT,7571 TULE SPRINGS,LAS VEGAS,NV,89131,Clark,firstservice residential nevada,firstservice residential nevada,firstservice residential nevada,firstservice residential nevada,8290 arville st,False
SAN ANTONIO RANCH PROPERTY OWNERS ASSOCIATION,405-1992,REG,9,(775) 782-6340,C/O COMMUNITY ASSOCIATION MANAGEMENT COMPANY,2240 MERIDIAN BLVD STE D,MINDEN,NV,89423,Washoe,first columbia community management,first columbia community management,first columbia community management,first columbia community management,po box 28759,False
SAN DESTIN ARROYO @ ALIANTE,SAME AS MASTER,SAM,76,(702) 638-7770,"C/O FIRSTSERVICE RESIDENTIAL, NEVADA, LLC",8290 ARVILLE ST,LAS VEGAS,NV,89139,Clark,firstservice residential nevada,firstservice residential nevada,firstservice residential nevada,firstservice residential nevada,8290 arville st,False
SAN DESTIN PALAZZO @ ALIANTE,SAME AS MASTER,SAM,186,(702) 638-7770,"C/O FIRSTSERVICE RESIDENTIAL, NEVADA, LLC",8290 ARVILLE ST,LAS VEGAS,NV,89139,Clark,associa sierra north,associa sierra north,associa sierra north,associa sierra north,10509 professional circle 200,False
SAN DESTIN RAVELLO @ ALIANTE,SAME AS MASTER,SAM,236,(702) 638-7770,"C/O FIRSTSERVICE RESIDENTIAL, NEVADA, LLC",8290 ARVILLE ST,LAS VEGAS,NV,89139,Clark,associated management,associa sierra north,associa sierra north,associated management,5955 tyrone rd,True
SAN DESTIN TIVOLI @ ALIANTE,SAME AS MASTER,SAM,173,(702) 638-7770,"C/O FIRSTSERVICE RESIDENTIAL, NEVADA, LLC",8290 ARVILLE ST,LAS VEGAS,NV,89139,Clark,nicklin property management,nicklin property management,nicklin property management,nicklin property management,375 n stephanie,False
SAN GABRIEL UNIT 1 AT MOUNTAIN'S EDGE HOMEOWNERS ASSOCIATION,0785062006-4,SUB,156,(702) 531-3382,C/O CAMCO,PO BOX 400518,LAS VEGAS,NV,89140,Clark,regal property management,regal property management,regal property management,regal property management,3945 w reno ave,False
SAN GIOVANNI COURT ESTATES HOMEOWNERS ASSOCIATION,0093842011-8,SUB,4,(702) 260-2013,,3055 VIA SARAFINA DR,HENDERSON,NV,89052,Clark,,,,,,
SAN MARCELLO HOMEOWNERS' ASSOCIATION,0680232011-6,REG,102,(702) 942-2500,C/O COMMUNITY MANAGEMENT GROUP,2450 BOX CANYON DR,LAS VEGAS,NV,89128,Clark,nicklin property management investment,nicklin property management investment,nicklin property management,nicklin property management,375 n stephanie st,False
SAN MARCOS AT SUMMERLIN HOMEOWNERS ASSOCIATION,33575-2001,SUB,111,(702) 942-2500,C/O COMMUNITY MANAGEMENT GROUP,2450 BOX CANYON DR,LAS VEGAS,NV,89128,Clark,colonial property management,colonial property management,colonial property management,colonial property management,736 w pioneer blvd,False
"SAN MARINO CIRCLE HOMEOWNERS ASSOCIATION, A NEVADA NON PROFIT",4139-2001,REG,135,(702) 736-9450,C/O TAYLOR ASSOCIATION MANAGEMENT,259 N PECOS RD STE 100,HENDERSON,NV,89074,Clark,associated professional service,associated professional service,associated professional service,associated professional service,5096 w post rd,False
SAN MARINO PROPERTY OWNERS ASSOCIATION,14957-1999,SUB,215,(702) 737-8580,C/O FIRSTSERVICE RESIDENTIAL NEVADA LLC,8290 ARVILLE ST,LAS VEGAS,NV,89139,Clark,assured real estate,assured real estate,assured real estate,assured real estate,po box 530778,False
SAN NICCOLO AT SOUTHERN HIGHLANDS HOMEOWNERS ASSOCIATION,22777-2003,SUB,300,(702) 737-8580,"C/O FIRSTSERVICE RESIDENTIAL, NEVADA LLC",8290 ARVILLE ST,LAS VEGAS,NV,89139,Clark,firstservice residential nevada,firstservice residential nevada,firstservice residential nevada,firstservice residential nevada,8290 arville st,False
SAN RAFAEL HOMEOWNERS ASSOCIATION INC,27631-1997,REG,147,(702) 737-8580,"C/O FIRSTSERVICE RESIDENTIAL, NEVADA, LLC",8290 ARVILLE ST,LAS VEGAS,NV,89139,Clark,associated professional service,associated professional service,associated professional service,associated professional service,5096 w post rd,False
SAN REMO HOMEOWNERS ASSOCIATION,2214-1977,REG,84,(702) 818-4780,C/O SHELTER MANAGEMENT GROUP INC,PO BOX 777008,HENDERSON,NV,89077,Clark,camco,camco,camco,camco,p o box 400518,False
SAN SEVERO HOMEOWNERS ASSOCIATION,0639032014-4,REG,324,(702) 531-3392,C/O CAMCO,PO BOX 400815,LAS VEGAS,NV,89140,Clark,taylor association management,taylor association management,taylor association management,taylor association management,259 n peco rd,False
SAN SEVINO EAST AT SOUTHERN HIGHLANDS HOMEOWNERS ASSOCIATION,22780-2003,SUB,44,(702) 737-8580,C/O FIRSTSERVICE RESIDENTIAL NEVADA LLC,8290 ARVILLE STREET,LAS VEGAS,NV,89139,Clark,colonial property management,colonial property management,colonial property management,colonial property management,736 w pioneer blvd,False
SAN SEVINO WEST AT SOUTHERN HIGHLANDS HOMEOWNERS ASSOCIATION,32122-2003,SUB,45,(702) 362-6262,C/O TERRA WEST MANAGEMENT SERVICES,PO BOX 80900,LAS VEGAS,NV,89180,Clark,nevada community management,nevada community management,nevada community management,nevada community management,9440 w sahara ave,False
SANDPIPER GOLF VILLAS HOMEOWNERS ASSOCIATION,567-1990,SUB,123,(702) 982-0430,C/O DESERT COMMUNITY MANAGEMENT,5550 PAINTED MIRAGE RD STE 120,LAS VEGAS,NV,89149,Clark,colonial property management,colonial property management,colonial property management,colonial property management,736 w pioneer blvd,False
SANDSTONE AT ELDORADO HOMEOWNERS' ASSOCIATION,0612782008-4,REG,400,(702) 257-1277,C/O ASSOCIATED PROFESSIONAL SERVICES,5096 W POST RD,LAS VEGAS,NV,89118,Clark,howard hughe,howard hughe,howard hughe,howard hughe,10801 w charleston blvd 3rd fl,False
SANDSTONE EDGE HOMEOWNERS ASSOCIATION,0078862015-5,REG,11,(702) 982-2587,C/O NEVADA FINEST PROPERTIES,3568 E RUSSELL RD STE A,LAS VEGAS,NV,89120,Clark,howard hughe,howard hughe,howard hughe,howard hughe,1980 festival plaza drive,False
SANDSTONE RECREATION ASSOCIATION INC,12579-1993,SUB,89,(702) 736-9450,C/O TAYLOR ASSOCIATION MANAGEMENT,259 N PECOS RD STE 100,HENDERSON,NV,89074,Clark,howard hughe,howard hughe,howard hughe,howard hughe,1980 festival plaza drive,False
SANDSTONE RIDGE ASSOCIATION,2079-2000,REG,141,(702) 531-3382,C/O CAMCO,PO BOX 400518,LAS VEGAS,NV,89140,Clark,colonial property management,colonial property management,colonial property management,colonial property management,736 w pioneer blvd,False
SANDY RIDGE COMMUNITY ASSOCIATION,2143-1998,REG,90,(702) 736-9450,C/O TAYLOR ASSOCIATION MANAGEMENT,259 N PECOS RD STE 100,HENDERSON,NV,89074,Clark,associa nevada south,associa nevada south,associa nevada south,associa nevada south,3675 w cheyenne ave,False
SANTA BARBARA HOMEOWNERS ASSOCIATION,21618-1995,SUB,190,(702) 531-3382,C/O CAMCO,PO BOX 400518,LAS VEGAS,NV,89140,Clark,service mortgage,service mortgage,service mortgage,service mortgage,377 n main st,False
SANTA BARBARA VILLAGE HOMEOWNERS ASSOCIATION,6798-1983,REG,40,(702) 365-6720,C/O FIRST COLUMBIA COMMUNITY MANAGEMENT INC,PO BOX 28759,LAS VEGAS,NV,89126,Clark,associated professional service,associated professional service,associated professional service,associated professional service,5096 w post rd,False
SANTA BELLA HOMEOWNERS ASSOCIATION,30588-2001,REG,128,(702) 515-2042,C/O THOROUGHBRED MANAGEMENT INC,"710 CORONADO CENTER DR, SUITE 120",HENDERSON,NV,89052,Clark,mp association management,mp association management,mp association management,mp association management,6029 s ft apache rd,False
SANTA FE @ SUMMERLIN NORTH,SAME AS MASTER,SAM,153,(702) 838-5500,C/O SUMMERLIN COMMUNITY MANAGEMENT,2120 SNOW TRAIL,LAS VEGAS,NV,89134,Clark,terra west management service,terra west management service,terra west management service,terra west management service,po box 80900,False
SANTA FE HACIENDAS HOMEOWNERS ASSOCIATION,4224-1987,REG,66,(702) 736-9450,C/O TAYLOR ASSOCIATION MANAGEMENT,259 N PECOS RD STE 100,HENDERSON,NV,89074,Clark,incline property management,incline property management,incline property management,incline property management,848 tanager st,False
SANTA FE HOMEOWNERS ASSOCIATION,10479-1997,REG,225,(702) 531-3382,C/O CAMCO,PO BOX 400518,LAS VEGAS,NV,89140,Clark,trinity and associate,trinity associate,trinity associate,trinity and associate,po box 4677,True
SANTA MARGARITA HOMEOWNERS ASSOCIATION,12107-1993,REG,84,(702) 754-6313,C/O SIERRA COMMUNITY MANAGEMENT,"6280 S. VALLEY VIEW, SUITE #310",LAS VEGAS,NV,89147,Clark,firstservice residential nevada,firstservice residential nevada,firstservice residential nevada,firstservice residential nevada,8290 arville st,False
SANTA MARIA RANCH HOMEOWNERS' ASSOCIATION,0099962005-0,MSTR,568,(775) 884-6176,C/O INCLINE PROPERTY MANAGEMENT,848 TANAGER ST STE M,INCLINE VILLAGE,NV,89451,Lyon,seabreeze management,seabreeze management,seabreeze management,seabreeze management,1350 flat top mesa dr,False
SANTA ROSA HOMEOWNERS ASSOCIATION,12583-2002,REG,71,(702) 222-2391,"C/O NEVADA COMMUNITY MANAGEMENT, LLC",9440 W SAHARA AVE STE 237,LAS VEGAS,NV,89117,Clark,terra west management service,terra west management service,terra west management service,terra west management service,po box 80900,False
SANTA ROSA II HOMEOWNERS ASSOCIATION,25545-2002,REG,41,(702) 405-3300,C/O PINNACLE COMMUNITY ASSOCIATION MANAGEMENT,8311 W SUNSET RD STE 110,LAS VEGAS,NV,89113,Clark,real propertie management group,real propertie management group,real propertie management group,real propertie management group,po box 95606,False
SANTA ROSA III HOMEOWNERS ASSOCIATION,20928-2003,REG,98,(702) 856-3826,C/O TERRA WEST MANAGEMENT SERVICES,PO BOX 80900,LAS VEGAS,NV,89180,Clark,colonial property management,colonial property management,colonial property management,colonial property management,736 w pioneer blvd,False
SANTA THERESA ESTATES HOMEOWNER'S ASSOCIATION,0057042009-4,REG,99,(702) 345-2200,C/O COLONIAL PROPERTY MANAGEMENT,736 W PIONEER BLVD STE 200,MESQUITE,NV,89027,Clark,kenyon associate,kenyon associate,kenyon associate,kenyon associate,645 sierra rose dr,False
SANTALINA @ SUMMERLIN WEST COMMUNITY ASSOCIATION,SAME AS MASTER,SAM,74,(702) 791-4600,C/O HOWARD HUGHES CORPORATION,10801 W CHARLESTON BLVD 3RD FL,LAS VEGAS,NV,89135,Clark,taylor association management,taylor association management,taylor association management,taylor association management,259 n peco rd,False
"SANTALUZ HOMEOWNER'S ASSOCIATION, THE",0289172013-5,SUB,53,(702) 531-3382,C/O CAMCO,PO BOX 400518,LAS VEGAS,NV,89140,Clark,firstservice residential nevada,firstservice residential nevada,firstservice residential nevada,firstservice residential nevada,8290 arville st,False
SANTIAGO HOMES OWNERS ASSOCIATION,14409-1993,REG,66,(702) 851-7660,C/O NICKLIN PROPERTY MANAGEMENT,375 N STEPHANIE ST STE 911B,HENDERSON,NV,89014,Clark,thoroughbred management,thoroughbred management,thoroughbred management,thoroughbred management,2555 w cheyenne ave,False
SAPPHIRE HOMEOWNERS ASSOCIATION,2335-1996,REG,141,(702) 458-2580,C/O COLONIAL PROPERTY MANAGEMENT,8595 S EASTERN AVE,LAS VEGAS,NV,89123,Clark,thoroughbred management,thoroughbred management,thoroughbred management,thoroughbred management,2555 w cheyenne ave,False
SAPPHIRE RIDGE LANDSCAPE MAINTENANCE ASSOCIATION,18082-2002,REG,150,(775) 337-2700,"C/O FIRSTSERVICE RESIDENTIAL, NEVADA, LLC",639 ISBELL RD STE 280,RENO,NV,89509,Washoe,thoroughbred management,thoroughbred management,thoroughbred management,thoroughbred management,2555 w cheyenne ave,False
SAPPHIRE SPRINGS HOMEOWNERS ASSOCIATION,0006382006-0,REG,74,(702) 222-2391,C/O NEVADA COMMUNITY MANAGEMENT,"9440 W. SAHARA, SUITE 237",LAS VEGAS,NV,89117,Clark,community management group,community management group,community management group,community management group,2450 box canyon dr,False
SARASOTA HOMEOWNERS' ASSOCIATION,0226122015-7,SUB,149,702-531-3382,C/O CAMCO,PO BOX 400518,LAS VEGAS,NV,89140,Clark,integrity based management,integrity based management,integrity based management,integrity based management,5715 s sandhill rd,False
SARATOGA SPRINGS ESTATES HOMEOWNERS ASSOCIATION,4575-1993,REG,541,(775) 782-0123,C/O NEW VALLEY REAL ESTATE MANAGEMENT,PO BOX 1034,MINDEN,NV,89423,Douglas,cdm management,cdm management,cdm management,cdm management,3650 s pointe circle 117,False
"SAVALLI ESTATES HOMEOWNERS' ASSOCIATION, INC.",3737-1980,REG,200,(702) 942-2500,C/O COMMUNITY MANAGEMENT GROUP,2450 BOX CANYON DR,LAS VEGAS,NV,89128,Clark,adept management service,adept management service,adept management service,adept management service,5550 painted mirage rd,False
SAVANNAH FALLS HOMEOWNERS ASSOCIATION,25965-2003,REG,91,(702) 856-3769,C/O TERRA WEST MANAGEMENT SERVICES,PO BOX 80900,LAS VEGAS,NV,89180,Clark,epic association management,epic association management,epic association management,epic association management,8712 spanish ridge ave,False
SAVANNAH HOMEOWNERS ASSOCIATION,0281332006-8,REG,45,(702) 736-9450,C/O TAYLOR ASSOCIATION MANAGEMENT,259 N PECOS RD STE 100,HENDERSON,NV,89074,Clark,firstservice residential nevada,firstservice residential nevada,firstservice residential nevada,firstservice residential nevada,8290 arville st,False
SAVANNAH PLACE HOMEOWNERS ASSOCIATION,0157222005-3,REG,201,(702) 737-8580,"C/O FIRSTSERVICE RESIDENTIAL, NEVADA, LLC",8290 ARVILLE ST,LAS VEGAS,NV,89139,Clark,terra west management service,terra west management service,terra west management service,terra west management service,po box 80900,False
"SAVONA COMMUNITY ASSOCIATION, INC.",0305802007-5,REG,64,(702) 531-3382,C/O CAMCO,PO BOX 400518,LAS VEGAS,NV,89140,Clark,ideal community management,ideal community management,ideal community management,ideal community management,5785 centennial center blvd,False
SAVONA HOMEOWNERS ASSOCIATION,0240692015-2,SUB,135,(702) 531-3382,C/O CAMCO,PO BOX 400518,LAS VEGAS,NV,89140,Clark,terra west management service,terra west management service,terra west management service,terra west management service,po box 80900,False
SBE HOA,0538272008-2,REG,29,(702) 386-3700,C/O AMS MANAGEMENT GROUP INC,"3100 W SAHARA RD, STE 112",LAS VEGAS,NV,89102,Clark,camco,camco,camco,camco,po box 400518,False
SBH 1 HOMEOWNERS' ASSOCIATION,32675-2004,REG,127,(702) 933-7764,C/O REAL PROPERTY MANAGEMENT GROUP,PO BOX 95606,LAS VEGAS,NV,89193,Clark,nicklin property management,nicklin property management,nicklin property management,nicklin property management,375 n stephanie st,False
SBH 2 HOMEOWNERS' ASSOCIATION,0036792005-4,REG,94,(702) 933-7764,C/O REAL PROPERTY MANAGEMENT GROUP,PO BOX 95606,LAS VEGAS,NV,89193,Clark,cornerstone community association management,cornerstone community association management,cornerstone community association management,cornerstone community association management,po box 93625,False
SBH 3 HOMEOWNERS' ASSOCIATION,0645822005-6,REG,127,(702) 933-7764,C/O REAL PROPERTY MANAGEMENT GROUP,PO BOX 95606,LAS VEGAS,NV,89193,Clark,gaston wilkerson association service,gaston wilkerson association service,gaston wilkerson association service,gaston wilkerson association service,4751 caughlin pkwy,False
SBH 4 HOMEOWNERS' ASSOCIATION,0777072005-4,REG,154,(702) 933-7764,C/O REAL PROPERTIES MANAGEMENT GROUP INC,PO BOX 95606,LAS VEGAS,NV,89193,Clark,prime community management,prime community management,prime community management,prime community management,181 n arroyo brande blvd,False
SBH 5 HOMEOWNERS' ASSOCIATION,0797952006-5,REG,124,(702) 933-7764,C/O REAL PROPERTIES MGMT GROUP,PO BOX 95606,LAS VEGAS,NV,89193,Clark,firstservice residential nevada,firstservice residential nevada,firstservice residential nevada,firstservice residential nevada,8290 arville st,False
SBH 6 HOMEOWNERS' ASSOCIATION,0323002012-8,REG,100,(702) 933-7764,"C/O REAL PROPERTIES MANAGEMENT GROUP, INC.",PO BOX 95606,LAS VEGAS,NV,89193,Clark,the management trust,the management trust,the management trust,the management trust,8485 w sunset rd,False
SBH 7 HOMEOWNERS' ASSOCIATION,0299332014-8,REG,104,(702) 933-7764,C/O REAL PROPERTIES MANAGEMENT GROUP INC,PO BOX 95606,LAS VEGAS,NV,89193,Clark,camco,camco,camco,camco,po box 400518,False
SBH 8 HOMEOWNERS' ASSOCIAITON,0590642015-0,REG,150,(702) 933-7764,"REAL PROPERTIES MANAGEMENT GROUP, INC.",PO BOX 95606,LAS VEGAS,NV,89193,Clark,,,,,,
SCARLET & GREY HOMEOWNERS ASSOCIATION,5685-1986,REG,44,(702) 434-5890,C/O GRISWOLD REAL ESTATE MANAGEMENT,3260 FOUNTAIN FALLS WAY STE 1026,N LAS VEGAS,NV,89032,Clark,mesa management,mesa management,mesa management,mesa management,9512 w flamingo rd,False
SCARLET CROSSING ASSOCIATION,8615-2004,REG,89,(702) 942-2500,C/O COMMUNITY MANAGEMENT GROUP,2450 BOX CANYON DRIVE,LAS VEGAS,NV,89128,Clark,camco,camco,camco,camco,po box 400518,False
SCARLETT CANYON HOMEOWNERS ASSOCIATION,13370-1998,SUB,73,(702) 933-7764,C/O REAL PROPERTY MANAGEMENT GROUP,PO BOX 95606,LAS VEGAS,NV,89193,Clark,thoroughbred management,thoroughbred management,thoroughbred management,thoroughbred management,2555 w cheyenne ave,False
SCENIC BROOK ESTATES COMMUNITY ASSOCIATION,0208002015-1,REG,20,(702) 982-2587,C/O NEVADAS FINEST PROPERTIES,3568 E RUSSELL RD SUITE A,LAS VEGAS,NV,89120,Clark,the management trust,the management trust,the management trust,the management trust,8485 w sunset rd,False
SCENIC VIEW TOWNHOMES OWNERS' ASSOCIATION,6058-1997,REG,75,(702) 345-2200,C/O COLONIAL PROPERTY MANAGEMENT,736 W PIONEER BLVD STE 200,MESQUITE,NV,89027,Clark,the management trust,the management trust,the management trust,the management trust,8485 w sunset rd,False
SCOTCH PINE HOMEOWNERS ASSOCIATION,14623-2000,REG,44,(775) 626-7333,C/O ASSOCIA SIERRA NORTH,10509 PROFESSIONAL CIR STE 200,RENO,NV,89521,Washoe,taylor association management,taylor association management,taylor association management,taylor association management,259 n peco rd,False
SCOTTSDALE PLACE HOMEOWNERS ASSOCIATION,1271-1988,REG,92,(702) 856-3833,C/O TERRA WEST MANAGEMENT SERVICES,"6655 S. CIMARRON RD, SUITE 200",LAS VEGAS,NV,89113,Clark,taylor association management hen,taylor association management,taylor association management,taylor association management,259 n peco rd,True
SCOTTSDALE POINTS HOMEOWNER ASSOCIATION,10568-1991,REG,184,(702) 222-2391,"C/O NEVADA COMMUNITY MANAGEMENT, LLC",9440 W SAHARA AVE STE 237,LAS VEGAS,NV,89117,Clark,covenant management,covenant management,covenant management,covenant management,2001 s jone blvd,False
SCOTTSDALE VALLEY HOMEOWNERS ASSOCIATION,18614-1995,REG,120,(702) 851-7660,C/O NICKLIN PROPERTY MANAGEMENT & INVESTMENTS INC,375 N STEPHANIE ST STE 911B,HENDERSON,NV,89014,Clark,firstservice residential nevada,firstservice residential nevada,firstservice residential nevada,firstservice residential nevada,8290 arville st,False
SE'VILLA COMMUNITY ASSOCIATION,6089-1991,SUB,80,(702) 982-0430,C/O DESERT COMMUNITY MANAGEMENT,5550 PAINTED MIRAGE RD STE 120,LAS VEGAS,NV,89149,Clark,associa nevada south,associa nevada south,associa nevada south,associa nevada south,3675 w cheyenne ave,False
SEASONS AT ALIANTE COMMUNITY ASSOCIATION,10763-2003,SUB,148,(702) 856-3725,C/O TERRA WEST MANAGEMENT SERVICES,PO BOX 80900,LAS VEGAS,NV,89180,Clark,taylor association management,taylor association management,taylor association management,taylor association management,259 n peco rd,False
"SEASONS HOMEOWNERS ASSOCIATION, THE",2300-2002,REG,380,(702) 737-8580,"C/O FIRSTSERVICE RESIDENTIAL, NEVADA, LLC",8290 ARVILLE ST,LAS VEGAS,NV,89139,Clark,real propertie management group,real propertie management group,real propertie management group,real propertie management group,po box 95606,False
"SECTION SEVEN COMMUNITY ASSOCIATION, THE",9438-1986,MSTR,2374,(702) 222-2391,"C/O NEVADA COMMUNITY MANAGEMENT, LLC",9440 W SAHARA AVE STE 237,LAS VEGAS,NV,89117,Clark,community management group,community management group,community management group,community management group,2450 box canyon dr,False
SEDONA @ SUMMERLIN NORTH,SAME AS MASTER,SAM,172,(702) 838-5500,C/O SUMMERLIN COMMUNITY MANAGEMENT,2120 SNOW TRAIL,LAS VEGAS,NV,89134,Clark,associa nevada south,associa nevada south,associa nevada south,associa nevada south,3675 w cheyenne ave,False
SEDONA HOMEOWNERS ASSOCIATION,14089-1999,SUB,69,(702) 345-2200,C/O COLONIAL PROPERTY MANAGEMENT,736 W PIONEER BLVD STE 200,MESQUITE,NV,89027,Clark,summerlin community management,summerlin community management,summerlin community management,summerlin community management,2120 snow trail,False
SEDONA SW HOMEOWNERS' ASSOCIATION,0476622012-6,REG,117,(702) 531-3382,C/O CAMCO,PO BOX 400518,LAS VEGAS,NV,89140,Clark,epic association management,epic association management,epic association management,epic association management,8712 spanish ridge ave,False
