Name,SOS#,Assn Type,# of Units,Telephone,Address1,Address2,City,State,Zip Code,County,Firm_Normalized,Firm_Final,Firm_ByPhone,Firm_ByAddress,Address2_Normalized,Name_Changed_Flag
CYPRESS POINTE @ SUMMERLIN NORTH,SAME AS MASTER,SAM,90,(702) 838-5500,C/O SUMMERLIN COMMUNITY MANAGEMENT,2120 SNOW TRAIL,LAS VEGAS,NV,89134,Clark,camco,camco,camco,camco,po box 400518,False
D'ANDREA COMMUNITY ASSOCIATION,13291-1999,MSTR,564,(775) 852-2224,C/O EQUUS MANAGEMENT GROUP,5480 RENO CORPORATE DR STE 100,RENO,NV,89511,Washoe,thoroughbred management,thoroughbred management,thoroughbred management,thoroughbred management,2555 w cheyenne ave,False
D'ANDREA RANCH PHASE-III HOMEOWNERS' ASSOCIATION,0454802011-1,REG,546,(775) 624-8967,"C/O FIRSTSERVICE RESIDENTIAL, NEVADA, LLC",639 ISBELL RD STE 280,RENO,NV,89509,Washoe,valley realty and management,valley realty and management,valley realty and management,valley realty and management,po box 2304,False
D'ARIA HOME OWNERS ASSOCIATION,0384982007-0,REG,32,(702) 237-9718,,7422 YONIE CT,LAS VEGAS,NV,89117,Clark,,,,,,
D.I.M.E. ADULT #3 ASSOCIATION (DESERT INN MOBILE ESTATES III),5597-1988,REG,487,(702) 458-0599,,5542 TRES PIEDRAS RD,LAS VEGAS,NV,89122,Clark,,,,,,
DAISY LEE HOMEOWNERS ASSOCIATION,0668642006-2,REG,58,(702) 920-6010,,2009 ALTA DR,LAS VEGAS,NV,89106,Clark,,,,,,
DAMONTE FOOTHILLS LANDSCAPE MAINTENANCE ASSOCIATION,0643092006-6,REG,317,(775) 626-7333,C/O ASSOCIA SIERRA NORTH,10509 PROFESSIONAL CIR STE 200,RENO,NV,89521,Washoe,camco,camco,camco,camco,po box 400518,False
DAMONTE RANCH LANDSCAPE MAINTENANCE ASSOCIATION,3256-2003,MSTR,6500,(775) 828-3664,C/O EUGENE BURGER MANAGEMENT CORPORATION,5011 MEADOWOOD MALL WY STE 200,RENO,NV,89502,Washoe,new valley real estate management,new valley real estate management,new valley real estate management,new valley real estate management,po box 723,False
DAMONTE RIDGE HOMEOWNERS ASSOCIATION,8843-2004,SUB,74,(775) 626-7333,C/O ASSOCIA SIERRA NORTH,10509 PROFESSIONAL CIR STE 200,RENO,NV,89521,Washoe,nicklin property management,nicklin property management,nicklin property management,nicklin property management,375 n stephanie st,False
DARBY GARDENS HOMEOWNERS' ASSOCIATION,0505022007-3,REG,8,(702) 493-6669,,3121 DARBY GARDENS CT,LAS VEGAS,NV,89146,Clark,,,,,,
DARK PEAK DRIVE HOMEOWNERS ASSOCIATION INC,8699-1992,SUB,12,(702) 649-7575,,10225 BUTTON WILLOW DR,LAS VEGAS,NV,89134,Clark,,,,,,
DAVYN RIDGE HOMEOWNERS' ASSOCIATION,0661692006-0,REG,438,(702) 515-2042,C/O THOROUGHBRED MANAGEMENT,2555 W CHEYENNE AVE,N LAS VEGAS,NV,89032,Clark,colonial property management,colonial property management,colonial property management,colonial property management,8595 s eastern ave,False
DAY DAWN CROSSING HOMEOWNERS ASSOCIATION,0163872005-8,REG,96,(702) 362-6262,C/O TERRA WEST MANAGEMENT SERVICES,PO BOX 80900,LAS VEGAS,NV,89113,Clark,triton hoa service,triton hoa service,triton hoa service,triton hoa service,7495 w azure drive,False
DAY DAWN ESTATES HOMEOWNERS ASSOCIATION,24391-2003,REG,80,(702) 942-2500,C/O COMMUNITY MANAGEMENT GROUP,2450 BOX CANYON DR,LAS VEGAS,NV,89128,Clark,taylor association management,taylor association management,taylor association management,taylor association management,259 n peco rd,False
DAY DAWN VILLAGE HOMEOWNERS ASSOCIATION,24488-2002,REG,40,(702) 396-6042,C/O DESERT HOA MANAGEMENT INC,PO BOX 750639,LAS VEGAS,NV,89136,Clark,equu management group,equu management group,equu management group,equu management group,5480 reno corporate dr,False
DAY DAWN VISTA HOMEOWNERS ASSOCIATION,0787692006-1,REG,94,(702) 856-3828,C/O TERRA WEST MANAGEMENT SERVICES,"6655 S CIMARRON ROAD, SUITE 200",LAS VEGAS,NV,89113,Clark,firstservice residential nevada,firstservice residential nevada,firstservice residential nevada,firstservice residential nevada,8290 arville st,False
DAY SPRING UNIT II PROPERTY OWNERS ASSOCIATION,3925-2002,REG,51,(702) 368-4637,C/O ELITE HOA MANAGEMENT INC,8425 W FLAMINGO RD STE 1,LAS VEGAS,NV,89147,Clark,nicklin property management,nicklin property management,nicklin property management,nicklin property management,375 n stephanie st,False
DAY STAR PROPERTY OWNERS ASSOCIATION,14716-1997,REG,41,(702) 386-3700,C/O AMS MANAGEMENT GROUP INC,3100 W SAHARA AVE STE 112,LAS VEGAS,NV,89102,Clark,colonial property management,colonial property management,colonial property management,colonial property management,8595 s eastern ave,False
DAYBREAK AT SUNRISE HIGHLANDS HOMEOWNER'S ASSOCIATION,0320662013-4,REG,81,(702) 531-3382,C/O CAMCO,PO BOX 400518,LAS VEGAS,NV,89140,Clark,shelter management group,shelter management group,shelter management group,shelter management group,po box 777008,False
DAYBREAK GARDENS PROPERTY OWNER ASSOCIATION,11995-1998,REG,53,(702) 835-6904,C/O THE MANAGEMENT TRUST,8485 W SUNSET RD STE. 100,LAS VEGAS,NV,89113,Clark,associa nevada south,associa nevada south,associa nevada south,associa nevada south,3675 w cheyenne ave,False
DAYSPRING PROPERTY OWNERS ASSOCIATION,18481-1999,REG,66,(702) 368-4637,C/O ELITE HOA MANAGEMENT INC,8425 W FLAMINGO RD STE 1,LAS VEGAS,NV,89147,Clark,taylor association management,taylor association management,taylor association management,taylor association management,259 n peco rd,False
DAYTON VALLEY COMMUNITY ASSOCIATION,925-1990,MSTR,824,(775) 885-5055,C/O VALLEY REALTY AND MANAGEMENT,3246 N CARSON ST STE 100,CARSON CITY,NV,89706,Lyon,ideal community management,ideal community management,ideal community management,ideal community management,5785 centennial center blvd,False
DEBRA LANE HOA LLC,0625122005-8,REG,10,(775) 831-2374,,PO BOX 5429,INCLINE VILLAGE,NV,89450,Washoe,,,,,,
"DECATUR MOUNTAIN VILLAS HOMEOWNERS' ASSOCIATION, INC.",16818-2002,REG,50,(702) 795-1740,C/O SHANNON DAY PROPERTY MANAGEMENT,PO BOX 97512,LAS VEGAS,NV,89193,Clark,controlled resource management group,controlled resource management group,controlled resource management group,controlled resource management group,83 continental dr,False
DEER CREEK OWNERS ASSOCIATION,19677-1998,REG,24,(775) 832-6604,C/O INCLINE PROPERTY MANAGEMENT,848 TANAGER ST STE M,INCLINE VILLAGE,NV,89451,Washoe,firstservice residential nevada,firstservice residential nevada,firstservice residential nevada,firstservice residential nevada,8290 arville st,False
DEER MEADOWS HOMEOWNERS ASSOCIATION,15943-1998,REG,20,(702) 754-6313,C/O SIERRA COMMUNITY MANAGEMENT,6280 S. VALLEY VIEW #310,LAS VEGAS,NV,89118,Clark,taylor association management,taylor association management,taylor association management,taylor association management,259 n peco rd,False
DEER SPRINGS HOMEOWNERS ASSOCIATION,0360862014-7,REG,89,(702) 531-3382,C/O CAMCO,PO BOX 400518,LAS VEGAS,NV,89140,Clark,las vega valley community management,las vega valley community management,las vega valley community management,las vega valley community management,7571 tule spring rd,False
DEERBROOKE ESTATES HOMEOWNERS ASSOCIATION,4163-1993,REG,69,(702) 396-6042,C/O DESERT HOA MANAGEMENT INC,PO BOX 750639,LAS VEGAS,NV,89136,Clark,community management group,community management group,community management group,community management group,2450 box canyon dr,False
DEERBROOKE HOMEOWNERS ASSOCIATION,8860-1992,REG,206,(702) 835-6904,C/O THE MANAGEMENT TRUST,8485 W SUNSET RD STE. 100,LAS VEGAS,NV,89113,Clark,griswold real estate management,griswold real estate management,griswold real estate management,griswold real estate management,3260 fountain fall way,False
DEL MAR DOWNS HOMEOWNER ASSOCIATION,1873-1985,REG,36,(702) 750-0530,C/O MESA MANAGEMENT,9512 W FLAMINGO RD STE 102,LAS VEGAS,NV,89147,Clark,ams management group,ams management group,ams management group,ams management group,3100 w sahara ave,False
DENALI AT MOUNTAIN'S EDGE HOMEOWNERS ASSOCIATION,0754642006-7,SUB,296,(702) 792-3344,C/O ASSOCIA NEVADA SOUTH,3675 W CHEYENNE AVE STE 100,N LAS VEGAS,NV,89032,Clark,elite hoa management,elite hoa management,elite hoa management,elite hoa management,8425 w flamingo rd,False
DESERT BLOOM HOMEOWNERS ASSOCIATION,13396-1999,SUB,204,(702) 368-4637,C/O ELITE HOA MANAGEMENT INC,8425 W FLAMINGO RD STE 1,LAS VEGAS,NV,89147,Clark,eugene burger management,eugene burger management,eugene burger management,eugene burger management,4576 n rancho dr,False
DESERT BUTTE DRIVE HOMEOWNERS ASSOCIATION INC,1428-1990,SUB,32,(702) 869-0937,C/O PRIME COMMUNITY MANAGEMENT LLC,181 N ARROYO GRANDE BLVD STE 125,HENDERSON,NV,89074,Clark,griswold real estate management,griswold real estate management,griswold real estate management,griswold real estate management,3260 fountain fall way,False
DESERT CANYON HOMEOWNERS ASSOCIATION,33691-2004,REG,432,(702) 737-8580,C/O FIRSTSERVICE RESIDENTIAL NEVADA LLC,8290 ARVILLE ST,LAS VEGAS,NV,89139,Clark,colonial property management,colonial property management,colonial property management,colonial property management,8595 s eastern ave,False
DESERT COVE ESTATES HOMEOWNERS ASSOCIATION INC,22665-1999,REG,43,(702) 795-1740,C/O SHANNON DAY PROPERTY MANAGEMENT,PO BOX 97512,LAS VEGAS,NV,89193,Clark,terra west management service,terra west management service,terra west management service,terra west management service,po box 80900,False
DESERT COVE HOMEOWNERS ASSOCIATION,22208-1999,REG,48,(702) 458-2580,C/O COLONIAL PROPERTY MANAGEMENT,8595 S EASTERN AVE,LAS VEGAS,NV,89123,Clark,associa nevada south,associa nevada south,associa nevada south,associa nevada south,3675 w cheyenne ave,False
DESERT CREEK OWNERS ASSOCIATION INC,1356-1990,REG,305,(702) 247-1115,C/O IDEAL COMMUNITY MANAGEMENT,5785 CENTENNIAL CENTER BLVD STE 210,LAS VEGAS,NV,89149,Clark,firstservice residential nevada,firstservice residential nevada,firstservice residential nevada,firstservice residential nevada,8290 arville st,False
DESERT CREST HOMEOWNERS' ASSOCIATION,0504052005-3,REG,199,(702) 754-6313,C/O SIERRA COMMUNITY MANAGEMENT,6280 S. VALLEY VIEW BLVD STE 310,LAS VEGAS,NV,89118,Clark,real propertie management group,real propertie management group,real propertie management group,real propertie management group,po box 95060,False
DESERT CRYSTAL DRIVE HOMEOWNERS ASSOCIATION INC,9318-1990,SUB,30,(702) 750-0530,C/O MESA MANAGEMENT,9512 W FLAMINGO RD STE 102,LAS VEGAS,NV,89147,Clark,firstservice residential nevada,firstservice residential nevada,firstservice residential nevada,firstservice residential nevada,8290 arville st,False
DESERT FAIRWAYS WEST HOMEOWNERS ASSOCIATION,3477-1988,SUB,58,(702) 982-0430,C/O DESERT COMMUNITY MANAGEMENT,5550 PAINTED MIRAGE RD STE 120,LAS VEGAS,NV,89149,Clark,thoroughbred management,thoroughbred management,thoroughbred management,thoroughbred management,2555 w cheyenne ave,False
DESERT FOOTHILLS HOMEOWNERS' ASSOCIATION,0476592012-1,REG,108,(702) 531-3382,C/O CAMCO,PO BOX 400518,LAS VEGAS,NV,89140,Clark,eugene burger management,eugene burger management,eugene burger management,eugene burger management,5011 meadowood mall wy,False
"DESERT GARDEN HOMEOWNERS ASSOCIATION, INC.",28725-2001,REG,148,(702) 873-3071,C/O EUGENE BURGER MANAGEMENT CORPORATION,PO BOX 751330,LAS VEGAS,NV,89130,Clark,integrity based management,integrity based management,integrity based management,integrity based management,5715 s sandhill rd,False
DESERT GREENS 2001 HOME OWNERS ASSOCIATION,125-2002,REG,323,(775) 751-9006,,350 W WILSON RD,PAHRUMP,NV,89048,Nye,,,,,,
DESERT GREENS HOMEOWNERS ASSOCIATION,893-1988,SUB,100,(702) 982-0430,C/O DESERT COMMUNITY MANAGEMENT,5550 PAINTED MIRAGE RD STE 120,LAS VEGAS,NV,89149,Clark,thoroughbred management,thoroughbred management,thoroughbred management,thoroughbred management,2555 w cheyenne ave,False
DESERT HIGHLANDS HOMEOWNERS ASSOCIATION,11085-1997,REG,567,(775) 826-8092,C/O CONTROLLED RESOURCES MANAGEMENT GROUP,83 CONTINENTAL DR STE B,RENO,NV,89509,Washoe,associa nevada south,associa nevada south,associa nevada south,associa nevada south,3675 w cheyenne ave,False
DESERT HOLLY DRIVE HOMEOWNERS ASSOCIATION,11125-1989,SUB,42,(702) 869-0937,C/O PRIME COMMUNITY MANAGEMENT LLC,181 N ARROYO GRANDE BLVD STE 125,HENDERSON,NV,89074,Clark,camco,camco,camco,camco,po box 400518,False
DESERT INN ESTATES OWNERS ASSOCIATION,4915-1978,REG,578,(702) 456-0624,,5280 MUIR WOODS PKWY,LAS VEGAS,NV,89122,Clark,,,,,,
DESERT INN MOBILE FAMILY ESTATES OWNERS ASSOCIATION,4917-1978,REG,403,(702) 835-6904,C/O THE MANAGEMENT TRUST,8485 W SUNSET RD STE. 100,LAS VEGAS,NV,89113,Clark,thoroughbred management,thoroughbred management,thoroughbred management,thoroughbred management,2555 w cheyenne ave,False
DESERT INN VILLAS HOMEOWNERS ASSOCIATION,2735-1983,REG,78,(702) 531-3382,C/O CAMCO,PO BOX 400518,LAS VEGAS,NV,89112,Clark,kallfelz team association management,kallfelz team association management,kallfelz team association management,kallfelz team association management,6595 w smoke ranch,False
"DESERT LAKES HOMEOWNER'S ASSOCIATION, INC",14870-1995,REG,827,(702) 737-8580,C/O FIRSTSERVICE RESIDENTIAL NEVADA LLC,8290 ARVILLE STREET,LAS VEGAS,NV,89139,Lyon,compass community management,compass community management,compass community management,compass community management,po box 36447,False
DESERT LINN OWNERS ASSOCIATION,13830-1992,REG,224,(702) 990-5066,"C/O AMERICAN NEVADA REALTY, LLC",2360 CORPORATE CIR STE 330,HENDERSON,NV,89074,Clark,kallfelz team association management,kallfelz team association management,kallfelz team association management,kallfelz team association management,6595 w smoke ranch rd 110,False
DESERT MIRAGE PROPERTY OWNERS' ASSOCIATION,10918-1993,REG,65,(775) 764-7204,,PO BOX 2568,PAHRUMP,NV,89041,Nye,,,,,,
DESERT MOON HOMEOWNERS ASSOCIATION,0665492005-9,REG,82,(702) 433-0149,C/O LEVEL PROPERTY MANAGEMENT,8966 SPANISH RIDGE AVE STE 100,LAS VEGAS,NV,89148,Clark,camco,camco,camco,camco,po box 400518,False
DESERT PARK AT GREEN VALLEY HOMEOWNERS ASSOCIATION,8079-1986,SUB,202,(702) 737-8580,"C/O FIRSTSERVICE RESIDENTIAL, NEVADA LLC",8290 ARVILLE ST,LAS VEGAS,NV,89139,Clark,firstservice residential nevada,firstservice residential nevada,firstservice residential nevada,firstservice residential nevada,8290 arville st,False
DESERT PARK HOMEOWNERS ASSOCIATION,3652-1985,REG,44,(702) 851-7660,C/O NICKLIN PROPERTY MANAGEMENT,375 N STEPHANIE ST STE 911B,HENDERSON,NV,89014,Clark,eugene burger management,eugene burger management,eugene burger management,eugene burger management,4576 n rancho dr,False
DESERT PINE VILLAS HOMEOWNERS ASSOCIATION,20528-1997,REG,194,(702) 982-0430,C/O DESERT COMMUNITY MANAGEMENT,5550 PAINTED MIRAGE RD STE 120,LAS VEGAS,NV,89149,Clark,camco,camco,camco,camco,po box 400518,False
DESERT RIDGE LANDSCAPE MAINTENANCE HOMEOWNERS' ASSOCIATION,0654842006-0,REG,85,(702) 736-9450,C/O TAYLOR ASSOCIATION MANAGEMENT,259 N PECOS RD STE 100,HENDERSON,NV,89074,Clark,firstservice residential nevada,firstservice residential nevada,firstservice residential nevada,firstservice residential nevada,8290 arville st,False
DESERT SANDS VILLAS HOMEOWNERS ASSOCIATION,774-1982,REG,130,(702) 309-3021,C/O HARMONY MANAGEMENT LLC,1151 S BUFFALO DR #230,LAS VEGAS,NV,89117,Clark,camco,camco,camco,camco,po box 400518,False
DESERT SHORES COMMUNITY ASSOCIATION,6404-1988,MSTR,1705,(702) 254-1020,,2500 REGATTA DR,LAS VEGAS,NV,89128,Clark,,,,,,
DESERT SHORES RACQUET CLUB HOMEOWNERS ASSOCIATION,10227-1989,SUB,195,(702) 365-6720,C/O FIRST COLUMBIA COMMUNITY MANAGEMENT INC,PO BOX 28759,LAS VEGAS,NV,89126,Clark,las vega valley community management,las vega valley community management,las vega valley community management,las vega valley community management,7571 tule spring rd,False
DESERT SKY ASSOCIATION,0218522005-3,REG,40,(702) 835-6904,C/O THE MANAGEMENT TRUST,8485 W SUNSET RD STE 100,LAS VEGAS,NV,89113,Clark,firstservice residential nevada,firstservice residential nevada,firstservice residential nevada,firstservice residential nevada,8290 arville st,False
DESERT SKY AT MOUNTAINS EDGE HOMEOWNERS ASSOCIATION,0558202005-6,SUB,103,(702) 638-7770,C/O FIRSTSERVICE RESIDENTIAL NEVADA LLC,8290 ARVILLE ST,LAS VEGAS,NV,89139,Clark,the management trust,the management trust,the management trust,the management trust,8485 w sunset rd,False
DESERT SPRINGS HOMEOWNERS ASSOCIATION INC,3754-1985,REG,265,(775) 626-7333,C/O ASSOCIA SIERRA NORTH,10509 PROFESSIONAL CIR STE 200,RENO,NV,89521,Washoe,community management group,community management group,community management group,community management group,2450 box canyon dr,False
DESERT TRAILS COMMUNITY ASSOCIATION,7886-1995,SUB,56,(702) 638-7770,"C/O FIRSTSERVICE RESIDENTIAL, NEVADA LLC",8290 ARVILLE ST,LAS VEGAS,NV,89139,Clark,pinnacle community association management,pinnacle community association management,pinnacle community association management,pinnacle community association management,8311 w sunset rd,False
DESERT TRAILS PROPERTY OWNERS ASSOCIATION,5300-1995,REG,81,(435) 705-4868,,PO BOX 9566,PAHRUMP,NV,89060,Nye,,,,,,
"DESERT WILLOWS LANDSCAPE MAINTENANCE ASSOCIATION, INC.",3962-2002,REG,549,(702) 737-8580,"C/O FIRSTSERVICE RESIDENTIAL, NEVADA, LLC",8290 ARVILLE ST,LAS VEGAS,NV,89139,Clark,camco,camco,camco,camco,po box 400518,False
DESIGN ESTATES HOMEOWNERS ASSOCIATION,11776-1999,REG,21,(702) 655-2547,,4690 DESIGNER WY,LAS VEGAS,NV,89129,Clark,,,,,,
"DEVONRIDGE HOMEOWNERS ASSOCIATION, INC",18523-2004,REG,48,(702) 458-2580,C/O COLONIAL PROPERTY MANAGEMENT,8595 S EASTERN AVE,LAS VEGAS,NV,89123,Clark,adept management service,adept management service,adept management service,adept management service,5550 painted mirage rd,False
DIAMANTE WEST HOMEOWNERS ASSOCIATION,0238172006-5,REG,81,(702) 515-2042,"C/O THOROUGHBRED MANAGEMENT, INC.",2555 W CHEYENNE AVE,N LAS VEGAS,NV,89032,Clark,terra west management service,terra west management service,terra west management service,terra west management service,po box 80900,False
DIAMOND BAY HOMEOWNERS ASSOCIATION,4540-1989,SUB,70,(702) 362-6262,C/O TERRA WEST PROPERTY MANAGEMENT,PO BOX 80900,LAS VEGAS,NV,89180,Clark,real propertie management group,real propertie management group,real propertie management group,real propertie management group,po box 95606,False
DIAMOND CREEK COMMUNITY ASSOCIATION,12360-2001,REG,105,(702) 531-3382,C/O CAMCO,PO BOX 400518,LAS VEGAS,NV,89140,Clark,eugene burger management,eugene burger management,eugene burger management,eugene burger management,po box 751330,False
DIAMOND CREEK HOMEOWNERS' ASSOCIATION,0538252005-9,SUB,191,(702) 309-3021,C/O HARMONY MANAGEMENT LLC,2300 W SAHARA AVE STE 800,LAS VEGAS,NV,89102,Clark,desert hoa management,desert hoa management,desert hoa management,desert hoa management,po box 750639,False
DIAMOND HEAD VILLAS ASSOCIATION PHASE II,9508-1996,REG,32,(702) 395-2399,"C/O TRITON HOA SERVICES, LLC",7495 W AZURE DR STE 110,LAS VEGAS,NV,89130,Clark,camco,camco,camco,camco,po box 400518,False
DIAMOND HEAD VILLAS INC,3285-1981,REG,32,(702) 395-2399,"C/O TRITON HOA SERVICES, LLC",7495 W AZURE DR STE 101,LAS VEGAS,NV,89130,Clark,camco,camco,camco,camco,po box 400518,False
DIAMOND J HOMEOWNERS ASSOCIATION,26134-1996,REG,22,,,2301 DIAMOND J PLACE,RENO,NV,89511,Washoe,,,,,,
DIAMOND POINT HOMEOWNERS ASSOCIATION,0525602005-5,REG,187,(702) 655-7064,C/O LAS VEGAS VALLEY COMMUNITY MANAGEMENT,7571 TULE SPRINGS RD,LAS VEGAS,NV,89131,Clark,howard hughe,howard hughe,howard hughe,howard hughe,10801 w charleston blvd 3rd fl,False
DIAMOND RANCH ESTATES HOMEOWNERS ASSOCIATION,0404752008-9,REG,40,(702) 531-3382,C/O CAMCO,P O BOX 400518,LAS VEGAS,NV,89140,Clark,taylor association management,taylor association management,taylor association management,taylor association management,259 n peco rd,False
DIAMOND RIDGE OWNERS ASSOCIATION,17412-1997,REG,8,(775) 832-6604,C/O INCLINE PROPERTY MANAGEMENT,848 TANAGER ST STE M,INCLINE VILLAGE,NV,89451,Washoe,sierra community management,sierra community management,sierra community management,sierra community management,6280 s valley view,False
DIAMOND SPRINGS ESTATES HOMEOWNERS ASSOCIATION,568-1997,REG,50,(702) 750-0530,C/O MESA MANAGEMENT,9512 W FLAMINGO RD STE 102,LAS VEGAS,NV,89147,Clark,omni community management,omni community management,omni community management,omni community management,18124 wedge parkway 245,False
DISCOVERY HILLS @ SUMMERLIN NORTH,SAME AS MASTER,SAM,109,(702) 838-5500,C/O SUMMERLIN COMMUNITY MANAGEMENT,2120 SNOW TRAIL,LAS VEGAS,NV,89134,Clark,the management trust,the management trust,the management trust,the management trust,8485 w sunset rd,False
DOLCE BY THE LAKES UNIT-OWNERS' ASSOCIATION,0307452006-3,REG,358,(702) 737-8580,"C/O FIRSTSERVICE RESIDENTIAL, NEVADA, LLC",8290 ARVILLE ST,LAS VEGAS,NV,89139,Clark,firstservice residential nevada,firstservice residential nevada,firstservice residential nevada,firstservice residential nevada,8290 arville st,False
DOMINION ESTATES PROPERTY OWNER'S ASSOCIATION,0240252005-8,REG,11,(702) 434-5890,C/O GRISWOLD REAL ESTATE MANAGEMENT,3260 FOUNTAIN FALLS WAY STE 1026,N LAS VEGAS,NV,89032,Clark,associa nevada south,associa nevada south,associa nevada south,associa nevada south,3675 w cheyenne ave,False
DORADO HOMEOWNERS ASSOCIATION,1735-2005,SUB,94,(702) 362-6262,C/O TERRA WEST PROPERTY MANAGEMENT,PO BOX 80900,LAS VEGAS,NV,89180,Washoe,nicklin property management investment,nicklin property management investment,nicklin property management,nicklin property management,375 n stephanie,False
DORRELL SQUARE HOMEOWNERS ASSOCIATION,15668-2004,REG,110,(702) 247-1115,C/O IDEAL COMMUNITY MANAGEMENT,5785 W CENTENNIAL CENTER BLVD STE 210,LAS VEGAS,NV,89149,Clark,colonial property management,colonial property management,colonial property management,colonial property management,8595 s eastern ave,False
DORRELL SUMMIT HOMEOWNERS ASSOCIATION,0274862014-2,REG,33,(702) 531-3382,C/O CAMCO,PO BOX 400518,LAS VEGAS,NV,89140,Clark,associa sierra north,associa sierra north,associa sierra north,associa sierra north,10509 professional cir,False
DOUBLE DIAMOND RANCH MASTER ASSOCIATION,21125-1996,MSTR,2072,(775) 853-9777,C/O TERRA WEST MANAGEMENT SERVICES,10651 PROFESSIONAL CIR STE A,RENO,NV,89521,Washoe,real property management group,real property management group,real propertie management group,real propertie management group,po box 95606,False
DOUBLE TREE HOMEOWNERS ASSOCIATION,5721-1995,REG,68,(775) 885-5055,C/O VALLEY REALTY AND MANAGEMENT,PO BOX 3587,CARSON CITY,NV,89702,Carson City,olympia management service,olympia management service,olympia management service,olympia management service,11411 southern highland pkwy,False
DOVE CANYON HOMEOWNERS ASSOCIATION,8376-2001,REG,188,(702) 362-6262,C/O TERRA WEST MANAGEMENT SERVICES,PO BOX 80900,LAS VEGAS,NV,89180,Clark,spanish trail master assn,spanish trail master assn,spanish trail master assn,spanish trail master assn,7495 mission hill dr,False
DRIFTWOOD BAY HOMEOWNERS ASSOCIATION,0095252014-2,REG,74,(702) 531-3382,C/O CAMCO,PO BOX 400518,LAS VEGAS,NV,89140,Clark,desert living,desert living,desert living,desert living,8925 s peco rd,False
DUCK CREEK VILLAGE I & II HOMEOWNERS ASSOCIATION,7333-1987,REG,366,(702) 767-9993,C/O EPIC ASSOCIATION MANAGEMENT,8712 SPANISH RIDGE AVE,LAS VEGAS,NV,89148,Clark,community management group,community management group,community management group,community management group,2450 box canyon dr,False
DUNCAN COURT HOMEOWNERS ASSOCIATION,185-1985,REG,44,(702) 982-2587,"C/O NEVADA'S FINEST PROPERTIES, LLC",3568 E. RUSSELL ROAD,LAS VEGAS,NV,89120,Clark,capital consultant management,capital consultant management,capital consultant management,capital consultant management,1 via vasari,False
DURANGO RANCH HOMEOWNERS' ASSOCIATION,0012532012-5,REG,200,(702) 257-1277,C/O ASSOCIATED PROFESSIONAL SERVICES,5096 W POST RD,LAS VEGAS,NV,89118,Clark,spanish trail master assn,spanish trail master assn,spanish trail master assn,spanish trail master assn,7495 w mission hill dr,False
DURANGO SPRINGS II LANDSCAPE MAINTENANCE ASSOCIATION,10008-2002,REG,111,(702) 795-3344,C/O ASSOCIA NEVADA SOUTH,3675 W CHEYENNE AVE STE 100,N LAS VEGAS,NV,89032,Clark,camco,camco,camco,camco,po box 400518,False
DURANGO SPRINGS LANDSCAPE MAINTENANCE ASSOCIATION,21879-2001,REG,113,(702) 405-3300,C/O PINNACLE COMMUNITY ASSOCIATION MANAGEMENT,"8311 W. SUNSET ROAD, SUITE 110",LAS VEGAS,NV,89113,Clark,eugene burger management,eugene burger management,eugene burger management,eugene burger management,po box 751330,False
DURANGO TRAIL ASSEMBLAGE HOMEOWNERS' ASSOCIATION,0264782013-9,REG,200,(702) 257-1277,C/O ASSOCIATED PROFESSIONAL SERVICES,5096 W POST RD,LAS VEGAS,NV,89118,Clark,thoroughbred management,thoroughbred management,thoroughbred management,thoroughbred management,2555 w cheyenne ave,False
"DURANGO TRAILS HOMEOWNERS ASSOCIATION, INC.",11538-1995,REG,278,(702) 362-0318,"C/O PERFORMANCE CAM, LLC",5135 CAMINO AL NORTE STE 210,N LAS VEGAS,NV,89031,Clark,associa sierra north,associa sierra north,associa sierra north,associa sierra north,10509 professional cir,False
DURANGO VALLEY ASSEMBLAGE COMMUNITY ASSOCIATION,0219112015-7,REG,80,(702) 257-1277 X 150,C/O ASSOCIATED PROFESSIONAL SERVICES,5096 W POST RD,LAS VEGAS,NV,89118,Clark,controlled resource management group,controlled resource management group,controlled resource management group,controlled resource management group,83 continental dr,False
EAGLE CANYON ASSOCIATION,10093-1996,REG,620,(775) 826-8092,C/O CONTROLLED RESOURCES MANAGEMENT GROUP,83 CONTINENTAL DR STE B,RENO,NV,89509,Washoe,abc management,abc management,abc management,abc management,6015 s virginia st e267,False
EAGLE CANYON ESTATES ASSOCIATION,3660-2002,REG,510,(775) 284-2050,C/O EQUUS MANAGEMENT GROUP,4888 SPARKS BLVD STE 102,SPARKS,NV,89436,Washoe,prime community management,prime community management,prime community management,prime community management,181 n arroyo grande blvd,False
EAGLE CANYON HOMEOWNERS ASSOCIATION,0280632005-2,REG,29,(702) 655-7064,C/O LAS VEGAS VALLEY COMMUNITY MANAGEMENT LLC,7571 TULE SPRINGS RD,LAS VEGAS,NV,89131,Clark,summerlin community management,summerlin community management,summerlin community management,summerlin community management,2120 snow trail,False
