Name,SOS#,Assn Type,# of Units,Telephone,Address1,Address2,City,State,Zip Code,County,Firm_Normalized,Firm_Final,Firm_ByPhone,Firm_ByAddress,Address2_Normalized,Name_Changed_Flag
LIGHTNING RIDGE DRIVE HOMEOWNERS ASSOCIATION INC,1585-1992,SUB,54,(702) 755-9555,C/O AMERICAN PROPERTY RESOURCES,3620 N RANCHO UNIT 118,LAS VEGAS,NV,89130,Clark,the management trust,the management trust,the management trust,the management trust,8485 w sunset rd,False
LINKS AT SPANISH TRAIL ASSOCIATION,743-1987,SUB,210,(702) 367-8747,C/O SPANISH TRAIL MASTER ASSN,7495 MISSION HILLS DR,LAS VEGAS,NV,89113,Clark,taylor association management,taylor association management,taylor association management,taylor association management,259 n peco rd,False
LINKVIEW DRIVE HOMEOWNERS ASSOCIATION INC,10041-1989,SUB,98,(702) 982-0430,C/O DESERT COMMUNITY MANAGEMENT LLC,6240 N DURANGO DR STE 115,LAS VEGAS,NV,89149,Clark,level property management,level property management,level property management,level property management,2897 loveland drive,False
LITCHFIELD AVENUE HOMEOWNERS ASSOCIATION INC,0656452005-4,SUB,58,(702) 645-1210,C/O ADEPT MANAGEMENT SERVICES INC,5550 PAINTED MIRAGE RD STE 320,LAS VEGAS,NV,89149,Clark,ams management group,ams management group,ams management group,ams management group,3100 w sahara ave,False
"LIVE OAK HOMEOWNERS' ASSOCIATION, INC AKA HERITAGE OAKS II",6321-1987,REG,32,(702) 523-3808,,4442 LIVE OAK DR,LAS VEGAS,NV,89121,Clark,,,,,,
LIVING SMART AT ELDORADO COMMUNITY ASSOCIATION,0385912011-0,REG,144,(702) 531-3382,C/O CAMCO,PO BOX 400518,LAS VEGAS,NV,89140,Clark,camco,camco,camco,camco,po box 400518,False
LIVING SMART AT PROVIDENCE COMMUNITY ASSOCIATION,0052402012-8,SUB,106,(702) 795-3344,C/O ASSOCIA NEVADA SOUTH,7670 W. LAKE MEAD BLVD STE 100,LAS VEGAS,NV,89128,Clark,camco,camco,camco,camco,po box 400518,False
LOCKWOOD COMMUNITY CORPORATION,28924-1999,REG,94,(775) 284-4434,C/O WESTERN NEVADA MANAGEMENT INC,255 PECKHAM LANE STE 2,RENO,NV,89509,Storey,olympia management service,olympia management service,,olympia management service,11411 southern highland pkwy,False
LODGEPOLE PARQUE HOMEOWNERS' ASSOCIATION,3819-1996,REG,18,(775) 832-0284,C/O INCLINE PROPERTY MANAGEMENT,848 TANAGER ST STE M,INCLINE VILLAGE,NV,89451,Washoe,olympia management service,olympia management service,,olympia management service,11411 southern highland pkwy,False
LOFT 5 HOMEOWNERS' ASSOCIATION,0797262006-2,REG,272,(702) 953-2226,C/O BBCM,5940 S. RAINBOW BLVD.,LAS VEGAS,NV,89118,Clark,on the ball,on the ball,on the ball,on the ball,1180 n town center dr,False
LOG CABIN ESTATES HOMEOWNERS ASSOCIATION,0012362006-6,SUB,110,(702) 835-6904,C/O THE MANAGEMENT TRUST,8485 W SUNSET RD STE 100,LAS VEGAS,NV,89113,Clark,olympia management service,olympia management service,olympia management service,olympia management service,11411 southern highland pkwy,False
LOG CABIN MANOR HOMEOWNERS ASSOCIATION,0012412006-3,SUB,339,(702) 835-6904,C/O THE MANAGEMENT TRUST,8485 W SUNSET RD STE 100,LAS VEGAS,NV,89113,Clark,olympia management service,olympia management service,olympia management service,olympia management service,11411 southern highland pkwy,False
LOG CABIN PONDEROSA HOMEOWNERS ASSOCIATION,0012372006-7,SUB,73,(702) 990-9707,C/O KALLFELZ TEAM ASSOCIATION MANAGEMENT LLC,6595 W SMOKE RANCH STE 110,LAS VEGAS,NV,89108,Clark,summerlin community management,summerlin community management,summerlin community management,summerlin community management,2120 snow trail,False
"LOMA LINDA HOMES, INC.",0444192010-3,REG,11,(702) 294-2956,,406 KEY BISCAYNE COURT,BOULDER CITY,NV,89005,Clark,,,,,,
LOMA POINTE HOMEOWNERS ASSOCIATION,0397532006-1,REG,96,(702) 515-2042,C/O THOROUGHBRED MANAGEMENT INC,2555 W CHEYENNE AVE,N LAS VEGAS,NV,89032,Clark,nicklin community management service,nicklin community management service,nicklin community management service,nicklin community management service,375 n stephanie st,False
LONE MOUNTAIN CLASSICS COMMUNITY ASSOCIATION,14163-2002,REG,108,(702) 754-6313,C/O SIERRA COMMUNITY MANAGEMENT,6280 S VALEY VIEW DR STE 310,LAS VEGAS,NV,89118,Clark,shelter management group,shelter management group,shelter management group,shelter management group,po box 777008,False
LONE MOUNTAIN ESTATES COMMUNITY ASSOCIATION,21493-2000,REG,28,(702) 737-8580,"C/O FIRSTSERVICE RESIDENTIAL, NEVADA, LLC",8290 ARVILLE ST,LAS VEGAS,NV,89139,Clark,camco,camco,camco,camco,po box 400518,False
LONE MOUNTAIN ESTATES HOMEOWNERS ASSOCIATION,0895902005-8,REG,28,(702) 856-3763,C/O TERRA WEST MANAGEMENT SERVICES,PO BOX 80900,LAS VEGAS,NV,89180,Clark,mkj,mjk,mjk,mjk,18124 wedge pkwy,True
LONE MOUNTAIN ESTATES OWNER'S ASSOCIATION,8318-1998,REG,9,(702) 233-4373,,4325 JERDON CT,LAS VEGAS,NV,89129,Clark,,,,,,
LONE MOUNTAIN HEIGHTS COMMUNITY ASSOCIATION,6501-2001,REG,360,(702) 361-6640,C/O OLYMPIA MANAGEMENT SERVICES,11411 SOUTHERN HIGHLANDS PKWY SUITE 100,LAS VEGAS,NV,89141,Clark,desert living,desert living,desert living,desert living,8925 s peco rd,False
LONE MOUNTAIN HOMEOWNERS ASSOCIATION,0008092011-4,REG,10,(702) 329-3054,C/O ROOFTOP ASSOCIATION MANAGEMENT,9041 S PECOS RD STE 4200,HENDERSON,NV,89074,Clark,sierra community management,sierra community management,sierra community management,sierra community management,6280 s valley view dr,False
LONE MOUNTAIN QUARTETTE COMMUNITY ASSOCIATION,13598-2004,REG,148,(702) 362-0318,C/O PERFORMANCE CAM,5135 CAMINO AL NORTE STE 100,N LAS VEGAS,NV,89031,Clark,terra west management service,terra west management service,terra west management service,terra west management service,6655 s cimarron rd,False
LONE MOUNTAIN RANCH ESTATES HOMEOWNERS ASSOCIATION,0565172013-0,REG,10,(702) 379-4849,,4071 VIA MONTAGNA,LAS VEGAS,NV,89129,Clark,,,,,,
"LONE MOUNTAIN SPRINGS LANDSCAPE MAINTENANCE ASSOCIATION, INC.",24193-2002,REG,57,(702) 737-8580,C/O FIRSTSERVICE RESIDENTIAL NEVADA LLC,8290 ARVILLE ST,LAS VEGAS,NV,89139,Clark,epic association management,epic association management,epic association management,epic association management,8712 spanish ridge ave,False
LONE MOUNTAIN TERRACE ASSOCIATION,27997-2002,REG,274,(702) 795-3344,C/O ASSOCIA NEVADA SOUTH,7670 W. LAKE MEAD BLVD STE 100,LAS VEGAS,NV,89128,Clark,adept management service,adept management service,adept management service,adept management service,5550 painted mirage rd,False
LONE MOUNTAIN VILLAGE ASSOCIATION,17393-1994,REG,180,(702) 942-2500,C/O COMMUNITY MANAGEMENT GROUP,2450 BOX CANYON DR,LAS VEGAS,NV,89128,Clark,the management trust,the management trust,the management trust,the management trust,8485 w sunset rd,False
LONE MOUNTAIN VISTAS COMMUNITY ASSOCIATION,9885-2001,REG,148,(702) 754-6313,C/O SIERRA COMMUNITY MANAGEMENT,6280 S VALLEY VIEW BLVD STE 310,LAS VEGAS,NV,89118,Clark,the management trust,the management trust,the management trust,the management trust,8485 w sunset rd,False
LONE MOUNTAIN VISTAS V HOMEOWNERS ASSOCIATION,0281312006-6,REG,77,(702) 835-6904,C/O THE MANAGEMENT TRUST,8485 W SUNSET RD STE 100,LAS VEGAS,NV,89113,Clark,thoroughbred management,thoroughbred management,thoroughbred management,thoroughbred management,2555 w cheyenne ave,False
LONE MOUNTAIN VISTAS VI HOMEOWNERS ASSOCIATION AKA LONE MOUNTAIN WEST UNIT 6 HOMEOWNERS ASSOCIATION,0281322006-7,REG,23,(702) 247-1115,C/O IDEAL COMMUNITY MANAGEMENT,5785 CENTENNIAL CENTER BLVD STE 210,LAS VEGAS,NV,89149,Clark,touchstone st rose,touchstone st rose,touchstone st rose,seabreeze management,9205 w russell rd,False
LONE MOUNTAIN WEST HOMEOWNERS ASSOCIATION,22142-2002,REG,108,(702) 531-3382,C/O CAMCO,PO BOX 400518,LAS VEGAS,NV,89140,Clark,camco,camco,camco,camco,po box 400518,False
LONG STREET TOWNHOUSES HOMEOWNERS ASSOCIATION,0677552005-1,REG,41,(702) 531-3382,C/O CAMCO,704 W NYE LANE SUITE 101,CARSON CITY,NV,89703,Washoe,camco,camco,camco,camco,po box 400518,False
LONGFORD AT PARADISE SPRINGS HOMEOWNERS ASSOCIATION,7083-1993,REG,72,(702) 795-3344,C/O ASSOCIA NEVADA SOUTH,7670 W. LAKE MEAD BLVD STE 100,LAS VEGAS,NV,89128,Clark,firstservice residential nevada,firstservice residential nevada,firstservice residential nevada,firstservice residential nevada,8290 arville st,False
LORETTO BAY MASTER ASSOCIATION,0400572006-1,MSTR,443,(702) 458-2580,C/O COLONIAL PROPERTY MANAGEMENT,8595 S EASTERN AVE,LAS VEGAS,NV,89123,Clark,summerlin community management,summerlin community management,summerlin community management,summerlin community management,2120 snow trail,False
LORETTO BAY-BELLA LAGO HOMEOWNERS ASSOCIATION,0428632006-1,SUB,137,(702) 515-2042,C/O THROUGHBRED MANAGEMENT,2555 W CHEYENNE AVE,N LAS VEGAS,NV,89032,Clark,terra west management service,terra west management service,terra west management service,terra west management service,6655 s cimarron rd,False
LORRYN PARC HOMEOWNERS ASSOCIATION,1168-2005,REG,20,(702) 362-6262,C/O TERRA WEST MANAGEMENT SERVICES,6655 S CIMARRON RD STE 200,LAS VEGAS,NV,89113,Clark,camco,camco,camco,camco,po box 400518,False
LOS ALTOS UNIT OWNERS ASSOCIATION,0358122015-6,SUB,78,(702) 531-3382,C/O CAMCO,PO BOX 400518,LAS VEGAS,NV,89140,Clark,desert community management,desert community management,desert community management,desert community management,6240 n durango dr,False
LOS PRADOS COMMUNITY ASSOCIATION INC,4141-1986,MSTR,1358,(702) 645-1379,,5150 LOS PRADOS CIR,LAS VEGAS,NV,89130,Clark,,,,,,
LOS SERRANOS @ MOUNTAIN'S EDGE,SAME AS MASTER,SAM,54,,C/O CAPITAL CONSULTANTS MANAGEMENT CORPORATION,8090 BLUE DIAMOND RD STE 240,LAS VEGAS,NV,89178,Clark,lynn cauley real estate management,lynne cauley real estate management,lynne cauley real estate management,lynn cauley real estate management,po box 1392,True
LOS VECINOS HOMEOWNERS ASSOCIATION,13534-1995,REG,35,(702) 521-8540,,1537 INDEPENDENCE WY,BOULDER CITY,NV,89005,Clark,,,,,,
LOS VERDES COMMUNITY ASSOCIATION,861-1991,REG,264,(702) 262-9091,C/O REAL PROPERTIES MANAGEMENT GROUP,3945 W. REGAL PROPERTY MANAGEMENT,LAS VEGAS,NV,89118,Clark,gaston wilkerson association service,gaston wilkerson association service,gaston wilkerson association service,gaston wilkerson association service,1675 robb dr,False
LOT 68 TAHOE VILLAGE UNIT 1 HOMEOWNERS ASSOCIATION,1518-1979,SUB,4,(925) 323-1100,C/O TAHOE VILLAGE HOMEOWNERS ASSOCIATION,2481 FRENCH OAK PLACE,LIVERMORE,CA,94550,Douglas,capital consultant management,capital consultant management,capital consultant management,capital consultant management,8090 blue diamond rd,False
LP HOMEOWNERS ASSOCIATION A.K.A. LAS PALMERAS,7852-1995,REG,427,(702) 933-7764,C/O REAL PROPERTIES MANAGEMENT GROUP INC,P O BOX 95606,LAS VEGAS,NV,89193,Clark,pandg,pandg,pandg,pandg,129 w lake mead pkwy,False
"LUCKY NUGGET ""2"" PROPERTY OWNERS' ASSOCIATION",11538-1992,REG,210,(775) 744-4596,,419 LOWER SOUTH FORK UNIT 7,SPRING CREEK,NV,89815,Elko,,,,,,
"LUNA DI LUSSO HOMEOWNERS' ASSOCIATION, INC.",0012862006-6,SUB,172,(702) 942-2500,C/O COMMUNITY MANAGEMENT GROUP,2450 BOX CANYON DR,LAS VEGAS,NV,89128,Clark,nicklin community management service,nicklin community management service,nicklin community management service,nicklin community management service,375 n stephanie st,False
LUSITANO RANCH COMMUNITY ASSOCIATION,2507762019-9,MSTR,36,(702) 515-2844,C/O TOLL NORTH LV LLC,1140 N TOWN CENTER DRIVE SUITE 250,LAS VEGAS,NV,89144,Clark,first columbia community management,first columbia community management,first columbia community management,first columbia community management,3100 w sahara 203,False
LYNBROOK MASTER ASSOCIATION,16370-1999,MSTR,1195,(702) 851-7660,C/O NICKLIN COMMUNITY MANAGEMENT SERVICES,375 N STEPHANIE ST STE 911,HENDERSON,NV,89014,Clark,terra west management service,terra west management service,terra west management service,terra west management service,10651 professional cir,False
LYON ESTATES HOMEOWNERS ASSOCIATION,0289032013-9,REG,179,(702) 362-6262,C/O TERRA WEST MANAGEMENT SERVICES,PO BOX 80900,LAS VEGAS,NV,89180,Clark,firstservice residential nevada,firstservice residential nevada,firstservice residential nevada,firstservice residential nevada,8290 arville st,False
MACCHIAVERNA VILLAS HOMEOWNERS ASSOCIATION,10466-1989,REG,28,(702) 982-2587,C/O NEVADA'S FINEST PROPERTIES LLC,3568 E RUSSELL RD,LAS VEGAS,NV,89120,Clark,ams management group,ams management group,ams management group,ams management group,3100 w sahara ave,False
MADEIRA CANYON HOMEOWNERS' ASSOCIATION,0270032005-8,REG,1004,(702) 795-3344,C/O ASSOCIA NEVADA SOUTH,7670 W. LAKE MEAD BLVD. SUITE 100,LAS VEGAS,NV,89128,Clark,taylor association management,taylor association management,taylor association management,taylor association management,259 n peco rd,False
MADERA COMMUNITY ASSOCIATION,30832-2001,REG,260,(702) 982-2587,C/O NEVADA'S FINEST PROPERTIES LLC,3568 E RUSSELL RD,LAS VEGAS,NV,89120,Clark,pandg,pandg,pandg,pandg,129 w lake mead pkwy 16,False
MADERA HOMEOWNERS ASSOCIATION,35598-2004,SUB,85,(702) 737-8580,"C/O FIRSTSERVICE RESIDENTIAL, NEVADA, LLC",8290 ARVILLE ST,LAS VEGAS,NV,89139,Clark,terra west management service,terra west management service,terra west management service,terra west management service,po box 80900,False
MADISON COLONY AT PROVIDENCE HOMEOWNERS ASSOCIATION,0051682008-3,SUB,168,(702) 531-3382,C/O CAMCO,PO BOX 400518,LAS VEGAS,NV,89140,Clark,colonial property management,colonial property management,colonial property management,colonial property management,8595 s eastern ave,False
MADISON ESTATES HOMEOWNERS ASSOCIATION,0298862006-0,REG,48,(702) 531-3382,C/O CAMCO,P O BOX 400518,LAS VEGAS,NV,89140,Clark,desert living,desert living,desert living,desert living,8925 s peco rd,False
MADISON ESTATES WEST LANDSCAPE MAINTENANCE ASSOCIATION,31594-2004,REG,25,(702) 646-2585,,3313 W SAN MIGUEL AVE,N LAS VEGAS,NV,89032,Clark,,,,,,
MADISON GROVE HOMEOWNERS ASSOCIATION,0069502007-2,SUB,124,(702) 433-0149,C/O LEVEL PROPERTY MANAGEMENT,8966 SPANISH RIDGE AVE STE 100,LAS VEGAS,NV,89148,Clark,summerlin community management,summerlin community management,summerlin community management,summerlin community management,2120 snow trail,False
MADISON HILLS HOMEOWNERS ASSOCIATION,0560262013-6,REG,447,(702) 515-2042,"C/O THOROUGHBRED MANAGEMENT, INC.",2555 W CHEYENNE AVE,N LAS VEGAS,NV,89032,Clark,sierra community management,sierra community management,sierra community management,sierra community management,6280 s valley view blvd,False
MADORI GARDENS HOMEOWNERS' ASSOCIATION,0265942014-1,REG,64,(702) 851-7660,C/O NICKLIN COMMUNITY MANAGEMENT,375 N. STEPHANIE STE 911,HENDERSON,NV,89014,Clark,real property management group,real property management group,real propertie management group,real propertie management group,po box 95606,False
MADORI VISTAS HOMEOWNERS' ASSOCIATION,0069432018-6,REG,136,(702) 818-4780,C/O SHELTER MANAGEMENT GROUP INC,PO BOX 777008,HENDERSON,NV,89077,Clark,jc nv,jc nv,jc nv,jc nv,5400 equity ave,False
MADRID ESTATES HOMEOWNERS ASSOCIATION INC,15869-1997,REG,87,(702) 458-2580,C/O COLONIAL PROPERTY MANAGEMENT,8595 S. EASTERN AVE.,LAS VEGAS,NV,89123,Clark,nevada finest propertie,nevada finest propertie,nevada finest propertie,nevada finest propertie,3568 e russell rd,False
MAGIC VIEW ESTATES HOMEOWNERS ASSOCIATION,0750802005-2,REG,76,(702) 942-2500,C/O COMMUNITY MANAGEMENT GROUP,2450 BOX CANYON DR,LAS VEGAS,NV,89128,Clark,nevada finest propertie,nevada finest propertie,nevada finest propertie,nevada finest propertie,3568 e russell rd,False
MAGNOLIA AT SUMMERLIN HOMEOWNERS ASSOCIATION,6427-2003,SUB,101,(702) 362-6262,C/O TERRA WEST MANAGEMENT SERVICES,6655 S CIMARRON RD STE 200,LAS VEGAS,NV,89113,Clark,nevada finest propertie,nevada finest propertie,nevada finest propertie,nevada finest propertie,3568 e russell rd,False
MAJESTIC HILLS COMMUNITY ASSOCIATION,30193-1998,SUB,338,(702) 869-0937,C/O PRIME COMMUNITY MANAGEMENT,181 N ARROYO GRANDE BLVD STE 125,HENDERSON,NV,89074,Clark,taylor association management hen,taylor association management hen,taylor association management,taylor association management,259 n peco rd,False
MAJESTIC HORIZONS AT NEVADA TRAILS II COMM ASSOCIATION,2018-2005,SUB,9,(702) 851-7660,C/O NICKLIN PROPERTY MANAGEMENT,"375 N STEPHANIE STREET, #911-B",HENDERSON,NV,89014,Clark,firstservice residential nevada,firstservice residential nevada,firstservice residential nevada,firstservice residential nevada,8290 arville st,False
MAJESTIC RANCH ESTATES II HOMEOWNERS ASSOCIATION,0174392013-3,REG,28,(775) 853-9771,C/O TERRA WEST MANAGEMENT SERVICES,10651 PROFESSIONAL CIR STE A,RENO,NV,89521,Washoe,on the ball,on the ball,on the ball,on the ball,1180 n town center dr 100,False
MAJESTIC RANCH ESTATES OWNERS ASSOCIATION,12872-2004,REG,16,(775) 828-3664,C/O EUGENE BURGER MANAGEMENT CORPORATION,5011 MEADOWOOD MALL WY STE 200,RENO,NV,89502,Washoe,associa sierra north,associa sierra north,associa sierra north,associa sierra north,10509 professional cir,False
MALIBU COMMUNITY ASSOCIATION,0352382015-0,REG,100,(702) 942-2500,C/O COMMUNITY MANAGEMENT GROUP,2450 BOX CANYON DR,LAS VEGAS,NV,89128,Clark,equu management group,equu management group,equu management group,equu management group,5480 reno corporate dr,False
MALIBU POINTE HOMEOWNERS ASSOCIATION,6581-1990,REG,40,(702) 982-2587,C/O NEVADA'S FINEST PROPERTIES LLC,3568 E RUSSELL RD,LAS VEGAS,NV,89120,Clark,associated community management,community management group,community management group,community management group,2450 box canyon drive,True
MALLARD CROSSING COMMUNITY ASSOCIATION,0458432018-7,REG,16,(775) 473-6565,C/O GASTON WILKERSON ASSOCIATION SERVICES,"1675 ROBB DRIVE, SUITE 5",RENO,NV,89523,Washoe,elite hoa management,elite hoa management,elite hoa management,elite hoa management,8425 w flamingo rd,False
MALTESE ESTATES HOMEOWNERS ASSOCIATION,0537522014-0,REG,9,(702) 648-7960,,4319 MALTESE CREST CT,LAS VEGAS,NV,89129,Clark,,,,,,
MANCHESTER AT HUNTINGTON HOMEOWNERS ASSOCIATION,27109-2004,SUB,237,(702) 737-8580,"C/O FIRSTSERVICE RESIDENTIAL, NEVADA, LLC",8290 ARVILLE ST,LAS VEGAS,NV,89139,Clark,prime community management,prime community management,prime community management,prime community management,181 n arroyo grande blvd,False
MANCHESTER AT WESTLAKE ASSOCIATION,5473-2003,REG,205,(702) 990-9707,C/O HOA MANAGEMENT,6595 W SMOKE RANCH STE 110,LAS VEGAS,NV,89108,Clark,firstservice residential nevada,firstservice residential nevada,firstservice residential nevada,firstservice residential nevada,8290 arville st,False
MANCHESTER PARK HOMEOWNERS ASSOCIATION,0459982006-9,SUB,252,(702) 247-1115,C/O IDEAL COMMUNITY MANAGEMENT,5785 CENTENNIAL CENTER BLVD STE 210,LAS VEGAS,NV,89149,Clark,camco,camco,camco,camco,po box 400518,False
MANDOLIN HOMEOWNERS ASSOCIATION,0436892006-1,SUB,174,,C/O NEVADA COMMUNITY MANAGEMENT,7571 TULE SPRINGS RD,LAS VEGAS,NV,89131,Clark,sierra community management,sierra community management,sierra community management,sierra community management,6280 s valley view st,False
MANHATTAN HOMEOWNERS' ASSOCIATION,27925-2004,REG,700,(702) 489-9184,C/O TERRA WEST MANAGEMENT SERVICES,6655 S CIMARRON RD STE 200,LAS VEGAS,NV,89113,Clark,ponderosa property management,ponderosa property management,ponderosa property management,ponderosa property management,po box 4403,False
MANNETTA LANE OWNERS ASSOCIATION,11707-1998,REG,90,(702) 362-6262,C/O TERRA WEST MANAGEMENT SERVICES,PO BOX 80900,LAS VEGAS,NV,89180,Clark,terra west management service,terra west management service,terra west management service,terra west management service,6655 cimarron rd,False
MANOR AT ALIANTE HOMEOWNERS ASSOCIATION,3795-2003,SUB,172,(702) 737-8580,C/O FIRSTSERVICE RESIDENTIAL NEVADA LLC,8290 ARVILLE ST,LAS VEGAS,NV,89139,Clark,camco,camco,camco,camco,po box 400518,False
MANORWOOD @ SUMMERLIN NORTH,SAME AS MASTER,SAM,120,(702) 838-5500,C/O SUMMERLIN COMMUNITY MANAGEMENT,2120 SNOW TRAIL,LAS VEGAS,NV,89134,Clark,incline property management,incline property management,incline property management,incline property management,123 w nye lane,False
MANTOVA COMMUNITY ASSOCIATION,18509-2002,SUB,123,(702) 737-8580,"C/O FIRSTSERVICE RESIDENTIAL, NEVADA, LLC",8290 ARVILLE ST,LAS VEGAS,NV,89139,Clark,firstservice residential nevada,firstservice residential nevada,firstservice residential nevada,firstservice residential nevada,8290 arville st,False
MANZANITA HOMEOWNERS' ASSOCIATION,0401242005-2,REG,409,(702) 643-1112,C/O ASSOCIA NEVADA SOUTH,7670 W. LAKE MEAD BLVD. SUITE 100,LAS VEGAS,NV,89128,Clark,firstservice residential nevada,firstservice residential nevada,firstservice residential nevada,firstservice residential nevada,8290 arville st,False
MAPLEWOOD HOMEOWNERS ASSOCIATION,22953-2003,REG,44,(702) 362-6262,C/O TERRA WEST PROPERTY MANAGEMENT,PO BOX 80900,LAS VEGAS,NV,89180,Clark,camco,camco,camco,camco,po box 400518,False
MAPLEWOOD II LANDSCAPE MAINTENANCE ASSOCIATION,26296-2004,REG,47,(702) 795-1740,C/O SHANNON DAY PROPERTY MANAGEMENT,PO BOX 97512,LAS VEGAS,NV,89193,Clark,equu management group,equu management group,equu management group,equu management group,4888 spark blvd,False
MAPLEWOOD SPRINGS HOMEOWNERS ASSOCIATION,23722-2004,REG,69,(702) 458-2580,C/O COLONIAL PROPERTY MANAGEMENT,8595 S EASTERN AVE,LAS VEGAS,NV,89123,Clark,reno property management,reno property management,reno property management,reno property management,1575 delucchi lane,False
MAR-A-LAGO HOMEOWNERS ASSOCIATION,2745-1993,SUB,444,(702) 433-0149,C/O LEVEL PROPERTY MANAGEMENT,8966 SPANISH RIDGE AVE STE 100,LAS VEGAS,NV,89148,Clark,eugene burger management,eugene burger management,eugene burger management,eugene burger management,5011 meadowood mall wy,False
MARAVILLA AT MOUNTAIN'S EDGE HOMEOWNERS ASSOCIATION,0482742005-9,SUB,402,(702) 531-3382,C/O CAMCO,PO BOX 400518,LAS VEGAS,NV,89140,Clark,eugene burger management,eugene burger management,eugene burger management,eugene burger management,po box 751330,False
MARAVILLA HOMEOWNERS ASSOCIATION,3529-2003,REG,266,(702) 942-2500,C/O COMMUNITY MANAGEMENT GROUP,2450 BOX CANYON DR,LAS VEGAS,NV,89128,Clark,firstservice residential nevada,firstservice residential nevada,firstservice residential nevada,firstservice residential nevada,8290 arville st,False
MARBELLA COMMUNITY ASSOCIATION,0565762013-1,REG,123,(702) 655-7064,C/O LAS VEGAS VALLEY COMMUNITY MANAGEMENT,7571 TULE SPRINGS ROAD,LAS VEGAS,NV,89131,Clark,associa nevada south,associa nevada south,associa nevada south,associa nevada south,7670 w lake mead blvd,False
MARBELLA HOMEOWNERS ASSOCIATION,13024-2000,SUB,96,(702) 262-9091,C/O REGAL PROPERTY MANAGEMENT,3945 W RENO AVE STE E,LAS VEGAS,NV,89118,Clark,firstservice residential nevada,firstservice residential nevada,firstservice residential nevada,firstservice residential nevada,8290 arville st,False
MARBLE CANYON @ SUMMERLIN NORTH,SAME AS MASTER,SAM,157,(702) 838-5500,C/O SUMMERLIN COMMUNITY MANAGEMENT,2120 SNOW TRAIL,LAS VEGAS,NV,89134,Clark,thoroughbred management,thoroughbred management,thoroughbred management,thoroughbred management,2555 w cheyenne ave,False
MARBLE CANYON ESTATES HOMEOWNERS ASSOCIATION,0234452013-4,REG,17,(702) 835-6904,C/O THE MANAGEMENT TRUST,8485 W SUNSET RD STE 100,LAS VEGAS,NV,89113,Clark,western nevada management,western nevada management,western nevada management,western nevada management,255 w peckham lane,False
MARBLE CANYON HOMEOWNERS' ASSOCIATION,0351142005-9,SUB,153,(702) 531-3382,C/O CAMCO,PO BOX 400518,LAS VEGAS,NV,89140,Clark,thoroughbred management,thoroughbred management,thoroughbred management,thoroughbred management,2555 w cheyenne ave,False
"MARIE ANTOINETTE HOMEOWNERS ASSOCIATION, INC",1999-1975,REG,139,(702) 262-9091,C/O REGAL PROPERTY MANAGEMENT,3945 W RENO AVE STE E,LAS VEGAS,NV,89118,Clark,taylor association management,taylor association management,taylor association management,taylor association management,259 n peco rd,False
MARINA COVE HOMEOWNERS ASSOCIATION,11186-1992,REG,24,(702) 736-9450,C/O TAYLOR ASSOCIATION MANAGEMENT,259 N. PECOS RD. #100,HENDERSON,NV,89074,Clark,eugene burger management,eugene burger management,eugene burger management,eugene burger management,p o box 751330,False
MARIPOSA @ SUMMERLIN WEST COMMUNITY ASSOCIATION,SAME AS MASTER,SAM,141,(702) 791-4600,C/O HOWARD HUGHES CORPORATION,10801 W CHARLESTON BLVD 3RD FL,LAS VEGAS,NV,89135,Clark,opu 1 community management,opu 1 community management,opu 1 community management,opu 1 community management,1380 greg st 208,False
MARIPOSA COMMUNITY ASSOCIATION INC,10433-1994,REG,248,(702) 990-9707,HOA MANAGEMENT,6595 W SMOKE RANCH STE 110,LAS VEGAS,NV,89108,Clark,,,,,,
MARIPOSA PLACE HOMEOWNERS ASSOCIATION,0602392005-2,REG,114,(702) 362-6262,C/O TERRA WEST MANAGEMENT SERVICES,PO BOX 80900,LAS VEGAS,NV,89180,Clark,eugene burger management,eugene burger management,eugene burger management,eugene burger management,po box 751330,False
MARQUESA HOMEOWNERS ASSOCIATION,19007-2004,REG,428,(702) 405-3300,C/O PINNACLE COMMUNITY ASSOCIATION MANAGEMENT,9330 W. SAHARA AVE STE 210,LAS VEGAS,NV,89117,Clark,firstservice residential nevada,firstservice residential nevada,firstservice residential nevada,firstservice residential nevada,8290 arville st,False
MARQUIS HOMEOWNERS' ASSOCIATION,0435992009-5,REG,14,(702) 362-6262,C/O TERRA WEST MANAGEMENT SERVICES,6655 S. CIMARRON STE 200,LAS VEGAS,NV,89113,Clark,equu management group,equu management group,equu management group,equu management group,5480 reno corporate dr,False
MARQUIS MANOR HOMEOWNERS ASSOCIATION,0421172016-0,REG,20,(702) 458-2580,C/O COLONIAL PROPERTY MANAGEMENT,8595 S EASTERN AVE,LAS VEGAS,NV,89123,Clark,seabreeze management,seabreeze management,seabreeze management,seabreeze management,9205 w russell rd,False
MARYCREST MANOR HOMEOWNERS ASSOCIATION,1949-1978,REG,22,(702) 795-3344,C/O ASSOCIA NEVADA SOUTH,3675 W CHEYENNE AVE STE 100,N LAS VEGAS,NV,89032,Clark,associa sierra north,associa sierra north,associa sierra north,associa sierra north,10509 professional cir,False
MARYLAND HACIENDAS HOMEOWNERS ASSOCIATION INC.,24042-2001,REG,67,(702) 737-0190,C/O THE PROPERTY GROUP,3286 BRENTWOOD ST,LAS VEGAS,NV,89121,Clark,ponderosa property management,ponderosa property management,ponderosa property management,ponderosa property management,po box 4675,False
