Name,SOS#,Assn Type,# of Units,Telephone,Address1,Address2,City,State,Zip Code,County,Firm_Normalized,Firm_Final,Firm_ByPhone,Firm_ByAddress,Address2_Normalized,Name_Changed_Flag
DESERT BUTTE DRIVE HOMEOWNERS ASSOCIATION INC,1428-1990,SUB,32,(702) 869-0937,C/O PRIME COMMUNITY MANAGEMENT LLC,181 N ARROYO GRANDE BLVD STE 125,HENDERSON,NV,89074,Clark,firstservice residential nevada,firstservice residential nevada,firstservice residential nevada,firstservice residential nevada,8290 arville st,False
DESERT CANYON HOMEOWNERS ASSOCIATION,33691-2004,REG,432,(702) 737-8580,C/O FIRSTSERVICE RESIDENTIAL NEVADA LLC,8290 ARVILLE ST,LAS VEGAS,NV,89139,Clark,terra west management service,terra west management service,terra west management service,terra west management service,6655 s cimarron rd,False
DESERT COVE ESTATES HOMEOWNERS ASSOCIATION INC,22665-1999,REG,43,(702) 795-1740,C/O SHANNON DAY PROPERTY MANAGEMENT,5460 S EASTERN AVE,LAS VEGAS,NV,89119,Clark,camco,camco,camco,camco,po box 400518,False
DESERT COVE HOMEOWNERS ASSOCIATION,22208-1999,REG,48,(702) 458-2580,C/O COLONIAL PROPERTY MANAGEMENT,8595 S EASTERN AVE,LAS VEGAS,NV,89123,Clark,triton hoa service,triton hoa service,triton hoa service,triton hoa service,7495 w azure drive,False
DESERT CREEK OWNERS ASSOCIATION INC,1356-1990,REG,305,(702) 247-1115,C/O IDEAL COMMUNITY MANAGEMENT,5785 CENTENNIAL CENTER BLVD STE 210,LAS VEGAS,NV,89149,Clark,taylor association management,taylor association management,taylor association management,taylor association management,259 n peco rd,False
DESERT CREST HOMEOWNERS' ASSOCIATION,0504052005-3,REG,199,(702) 754-6313,C/O SIERRA COMMUNITY MANAGEMENT,6280 S. VALLEY VIEW BLVD STE 310,LAS VEGAS,NV,89118,Clark,caughlin ranch hoa,caughlin,caughlin,caughlin ranch hoa,1070 cauglin crossing,True
DESERT CRYSTAL DRIVE HOMEOWNERS ASSOCIATION INC,9318-1990,SUB,30,(702) 869-0937,C/O PRIME COMMUNITY MANAGEMENT LLC,181 N ARROYO GRANDE BLVD STE 125,HENDERSON,NV,89012,Clark,firstservice residential nevada,firstservice residential nevada,firstservice residential nevada,firstservice residential nevada,8290 arville st,False
DESERT FAIRWAYS WEST HOMEOWNERS ASSOCIATION,3477-1988,SUB,58,(702) 982-0430,C/O DESERT COMMUNITY MANAGEMENT,6240 N DURANGO DR SUITE 115,LAS VEGAS,NV,89149,Clark,nicklin community management service,nicklin community management service,nicklin community management service,nicklin community management service,375 n stephanie st,False
DESERT FOOTHILLS HOMEOWNERS' ASSOCIATION,0476592012-1,REG,108,(702) 531-3382,C/O CAMCO,PO BOX 400518,LAS VEGAS,NV,89140,Clark,nicklin community management service,nicklin community management service,nicklin community management service,nicklin community management service,375 n stephanie st,False
"DESERT GARDEN HOMEOWNERS ASSOCIATION, INC.",28725-2001,REG,148,(702) 943-0981,"C/O 5STRMGT, LLC",8871 W FLAMINGO RD STE 202,LAS VEGAS,NV,89147,Clark,shelter management group,shelter management group,shelter management group,shelter management group,po box 777008,False
DESERT GREENS 2001 HOME OWNERS ASSOCIATION,125-2002,REG,323,(775) 751-9006,,350 W WILSON RD,PAHRUMP,NV,89048,Nye,,,,,,
DESERT GREENS HOMEOWNERS ASSOCIATION,893-1988,SUB,100,(702) 982-0430,C/O DESERT COMMUNITY MANAGEMENT,6240 N DURANGO DR STE 115,LAS VEGAS,NV,89149,Clark,taylor association management,taylor association management,taylor association management,taylor association management,259 n peco rd,False
DESERT HIGHLANDS HOMEOWNERS ASSOCIATION,11085-1997,REG,567,(775) 826-8092,C/O CONTROLLED RESOURCES MANAGEMENT GROUP,83 CONTINENTAL DR STE B,RENO,NV,89509,Washoe,ideal community management,ideal community management,ideal community management,ideal community management,5785 centennial center blvd,False
DESERT HOLLY DRIVE HOMEOWNERS ASSOCIATION,11125-1989,SUB,42,(702) 405-9902,,2251 N RAMPART BLVD STE 2528,LAS VEGAS,NV,89128,Clark,,,,,,
DESERT INN ESTATES OWNERS ASSOCIATION,4915-1978,REG,578,(702) 456-0624,,5280 MUIR WOODS PKWY,LAS VEGAS,NV,89122,Clark,,,,,,
DESERT INN MOBILE FAMILY ESTATES OWNERS ASSOCIATION,4917-1978,REG,403,(702) 767-9993,C/O EPIC ASSOCIATION MGMT,8712 SPANISH RIDGE AVE,LAS VEGAS,NV,89148,Clark,associa sierra north,associa sierra north,associa sierra north,associa sierra north,10509 professional cir,False
DESERT INN VILLAS HOMEOWNERS ASSOCIATION,2735-1983,REG,78,(702) 933-7764,C/O REAL PROPERTY MANAGEMENT GROUP,P O BOX 95606,LAS VEGAS,NV,89193,Clark,controlled resource management group,controlled resource management group,controlled resource management group,controlled resource management group,83 continental dr,False
"DESERT LAKES HOMEOWNER'S ASSOCIATION, INC",14870-1995,REG,828,(702) 737-8580,C/O FIRSTSERVICE RESIDENTIAL NEVADA LLC,8290 ARVILLE STREET,LAS VEGAS,NV,89139,Clark,firstservice residential nevada,firstservice residential nevada,firstservice residential nevada,firstservice residential nevada,8290 arville st,False
DESERT LINN OWNERS ASSOCIATION,13830-1992,REG,224,(702) 795-3344,C/O ASSOCIA NEVADA SOUTH,7670 W. LAKE MEAD BLVD STE 100,LAS VEGAS,NV,89014,Clark,ruby chang,ruby chang,ruby chang,ruby chang,3395 s jone blvd,False
DESERT MESA COMMUNITY ASSOCIATION,0026112018-7,REG,127,(702) 531-3382,C/O CAMCO,P O BOX 400518,LAS VEGAS,NV,89140,Clark,nevada finest propertie,nevada finest propertie,nevada finest propertie,nevada finest propertie,3568 e russell rd,False
DESERT MIRAGE PROPERTY OWNERS' ASSOCIATION,10918-1993,REG,65,(775) 537-8064,,PO BOX 2568,PAHRUMP,NV,89041,Nye,,,,,,
DESERT MOON HOMEOWNERS ASSOCIATION,0665492005-9,REG,82,(702) 222-2391,"C/O NEVADA COMMUNITY MANAGEMENT, LLC",9500 W FLAMINGO RD STE 204,LAS VEGAS,NV,89147,Clark,associa nevada south,associa nevada south,associa nevada south,associa nevada south,7670 w lake mead blvd,False
DESERT PARK AT GREEN VALLEY HOMEOWNERS ASSOCIATION,8079-1986,SUB,202,(702) 458-2580,C/O COLONIAL PROPERTY MANAGEMENT,8595 S. EASTERN AVE.,LAS VEGAS,NV,89123,Clark,camco,camco,camco,camco,po box 400518,False
DESERT PARK HOMEOWNERS ASSOCIATION INC,3652-1985,REG,44,(702) 990-9707,C/O HOA MANAGEMENT,6595 W. SMOKE RANCH #110,LAS VEGAS,NV,89108,Clark,griswold real estate management,griswold real estate management,griswold real estate management,griswold real estate management,3260 fountain fall way,False
DESERT PINE VILLAS HOMEOWNERS ASSOCIATION,20528-1997,REG,194,(702) 982-0430,C/O DESERT COMMUNITY MANAGEMENT,6240 N DURANGO DR STE 115,LAS VEGAS,NV,89149,Clark,ams management group,ams management group,ams management group,ams management group,3100 w sahara ave,False
DESERT RIDGE LANDSCAPE MAINTENANCE HOMEOWNERS' ASSOCIATION,0654842006-0,REG,85,(702) 736-9450,C/O TAYLOR ASSOCIATION MANAGEMENT,259 N PECOS RD STE 100,HENDERSON,NV,89074,Clark,elite hoa management,elite hoa management,elite hoa management,elite hoa management,8425 w flamingo rd,False
DESERT SANDS VILLAS HOMEOWNERS ASSOCIATION,774-1982,REG,130,(702) 362-0318,C/O PERFORMANCE CAM LLC,5135 CAMINO AL NORTE STE 100,N LAS VEGAS,NV,89031,Clark,firestservice residential nevada,firstservice residential nevada,firstservice residential nevada,firstservice residential nevada,8290 arville st,True
DESERT SHORES COMMUNITY ASSOCIATION,6404-1988,MSTR,1705,(702) 254-1020,,2500 REGATTA DR,LAS VEGAS,NV,89128,Clark,,,,,,
DESERT SHORES RACQUET CLUB HOMEOWNERS ASSOCIATION,10227-1989,SUB,195,(702) 365-6720,C/O FIRST COLUMBIA COMMUNITY MANAGEMENT INC,PO BOX 28759,LAS VEGAS,NV,89126,Clark,griswold real estate management,griswold real estate management,griswold real estate management,griswold real estate management,3260 fountain fall way,False
DESERT SKY ASSOCIATION,0218522005-3,REG,40,(702) 835-6904,C/O THE MANAGEMENT TRUST,8485 W SUNSET RD STE 100,LAS VEGAS,NV,89113,Clark,colonial property management,colonial property management,colonial property management,colonial property management,8595 s eastern ave,False
DESERT SKY AT MOUNTAINS EDGE HOMEOWNERS ASSOCIATION,0558202005-6,SUB,103,(702) 737-8580,C/O FIRSTSERVICE RESIDENTIAL NEVADA LLC,8290 ARVILLE ST,LAS VEGAS,NV,89139,Clark,terra west management service,terra west management service,terra west management service,terra west management service,po box 80900,False
DESERT SPRINGS HOMEOWNERS ASSOCIATION INC,3754-1985,REG,265,(775) 626-7333,C/O ASSOCIA SIERRA NORTH,10509 PROFESSIONAL CIR STE 200,RENO,NV,89521,Washoe,performance cam,performance cam,performance cam,performance cam,5135 camino al norte,False
DESERT TRACE HOMEOWNERS ASSOCIATION,0482112018-9,REG,12,(702) 395-2399,C/O TRITON HOA SERVICES LLC,7495 W. AZURE DRIVE SUITE 110,LAS VEGAS,NV,89130,Clark,firstservice residential nevada,firstservice residential nevada,firstservice residential nevada,firstservice residential nevada,8290 arville st,False
DESERT TRAILS COMMUNITY ASSOCIATION,7886-1995,SUB,56,(702) 754-6313,C/O SIERRA COMMUNITY MANAGEMENT,6280 S VALLEY VIEW STE 310,LAS VEGAS,NV,89118,Clark,firstservice residential nevada,firstservice residential nevada,firstservice residential nevada,firstservice residential nevada,8290 arville st,False
DESERT TRAILS PROPERTY OWNERS ASSOCIATION,5300-1995,REG,81,(775) 537-6436,,PO BOX 9566,PAHRUMP,NV,89060,Nye,,,,,,
"DESERT WILLOWS LANDSCAPE MAINTENANCE ASSOCIATION, INC.",3962-2002,REG,575,(702) 737-8580,"C/O FIRSTSERVICE RESIDENTIAL, NEVADA, LLC",8290 ARVILLE ST,LAS VEGAS,NV,89139,Clark,eugene burger management,eugene burger management,eugene burger management,eugene burger management,5011 meadowood mall wy,False
DESIGN ESTATES HOMEOWNERS ASSOCIATION,11776-1999,REG,21,(702) 655-2547,,4690 DESIGNER WY,LAS VEGAS,NV,89129,Clark,,,,,,
"DEVONRIDGE HOMEOWNERS ASSOCIATION, INC",18523-2004,REG,48,(702) 458-2580,C/O COLONIAL PROPERTY MANAGEMENT,8595 S EASTERN AVE,LAS VEGAS,NV,89123,Clark,soleil association management,soleil association management,soleil association management,soleil association management,5096 w post rd,False
DIAMANTE WEST HOMEOWNERS ASSOCIATION,0238172006-5,REG,81,(702) 515-2042,"C/O THOROUGHBRED MANAGEMENT, INC.",2555 W CHEYENNE AVE,N LAS VEGAS,NV,89032,Clark,camco,camco,camco,camco,p o box 400518,False
DIAMOND BAY HOMEOWNERS ASSOCIATION,4540-1989,SUB,70,(702) 856-3753,C/O TERRA WEST PROPERTY MANAGEMENT,PO BOX 80900,LAS VEGAS,NV,89180,Clark,triton hoa service,triton hoa service,triton hoa service,triton hoa service,7495 w azure drive,False
DIAMOND CREEK COMMUNITY ASSOCIATION,12360-2001,REG,105,(702) 767-9993,C/O EPIC ASSOCIAITION MANAGEMENT,8712 SPANISH RIDGE AVE,LAS VEGAS,NV,89148,Clark,thoroughbred management,thoroughbred management,thoroughbred management,thoroughbred management,2555 w cheyenne ave,False
DIAMOND CREEK HOMEOWNERS' ASSOCIATION,0538252005-9,SUB,190,(702) 222-2391,"C/O NEVADA COMMUNITY MANAGEMENT, LLC",9500 W FLAMINGO RD STE 204,LAS VEGAS,NV,89147,Clark,associa nevada south,associa nevada south,associa nevada south,associa nevada south,7670 w lake mead blvd,False
DIAMOND HEAD VILLAS ASSOCIATION PHASE II,9508-1996,REG,32,(702) 395-2399,"C/O TRITON HOA SERVICES, LLC",7495 W AZURE DR STE 110,LAS VEGAS,NV,89130,Clark,camco,camco,camco,camco,po box 400518,False
DIAMOND HEAD VILLAS INC,3285-1981,REG,53,(702) 395-2399,"C/O TRITON HOA SERVICES, LLC",7495 W AZURE DR STE 101,LAS VEGAS,NV,89130,Clark,hoa management,hoa management,hoa management,hoa management,6595 w smoke ranch,False
DIAMOND J HOMEOWNERS ASSOCIATION,26134-1996,REG,22,,,2301 DIAMOND J PLACE,RENO,NV,89511,Washoe,,,,,,
DIAMOND POINT HOMEOWNERS ASSOCIATION,0525602005-5,REG,187,(702) 655-7064,C/O LAS VEGAS VALLEY COMMUNITY MANAGEMENT,7571 SPRINGS ROAD,LAS VEGAS,NV,89131,Clark,nevada community management,nevada community management,las vega valley community management,las vega valley community management,7571 tule spring rd,False
DIAMOND RANCH ESTATES HOMEOWNERS ASSOCIATION,0404752008-9,REG,40,(702) 531-3382,C/O CAMCO,PO BOX 400518,LAS VEGAS,NV,89140,Clark,kallfelz team dba hoa management,hoa management,hoa management,hoa management,6595 w smoke ranch,True
DIAMOND RIDGE OWNERS ASSOCIATION,17412-1997,REG,8,(775) 832-6604,C/O INCLINE PROPERTY MANAGEMENT,848 TANAGER ST STE M,INCLINE VILLAGE,NV,89451,Washoe,compass community management,compass community management,compass community management,compass community management,po box 36447,False
DIAMOND SPRINGS ESTATES HOMEOWNERS ASSOCIATION,568-1997,REG,50,(702) 395-2399,C/O TRITON HOA SERVICES LLC,7495 W AZURE DR STE 110,LAS VEGAS,NV,89130,Clark,kallfelz team association management,hoa management,hoa management,hoa management,6595 w smoke ranch rd 110,True
DIAMOND TRAILS COMMUNITY ASSOCIATION,0391542018-0,REG,158,(949) 672-9079,"C/O SEABREEZE MANAGEMENT COMPANY, INC.",8960 W TROPICANA AVE,LAS VEGAS,NV,89147,Clark,nicklin community management service,nicklin community management service,nicklin community management service,nicklin community management service,375 n stephanie st,False
DISCOVERY HILLS @ SUMMERLIN NORTH,SAME AS MASTER,SAM,109,(702) 838-5500,C/O SUMMERLIN COMMUNITY MANAGEMENT,2120 SNOW TRAIL,LAS VEGAS,NV,89134,Clark,thoroughbred management,thoroughbred management,thoroughbred management,thoroughbred management,2555 w cheyenne ave,False
"DISTRICT AT GREEN VALLEY RANCH MASTER ASSOCIATION, INC, THE",24725-2004,MSTR,89,(702) 531-3382,C/O CAMCO,PO BOX 400518,LAS VEGAS,NV,89140,Clark,camco,camco,camco,camco,po box 400518,False
DOLCE BY THE LAKES UNIT-OWNERS' ASSOCIATION,0307452006-3,REG,360,(702) 737-8580,"C/O FIRSTSERVICE RESIDENTIAL, NEVADA, LLC",8290 ARVILLE ST,LAS VEGAS,NV,89139,Clark,camco,camco,camco,camco,po box 400518,False
DOMINION ESTATES PROPERTY OWNER'S ASSOCIATION,0240252005-8,REG,11,(702) 434-5890,C/O GRISWOLD REAL ESTATE MANAGEMENT,3260 FOUNTAIN FALLS WAY STE 1026,N LAS VEGAS,NV,89032,Clark,firstservice residential nevada,firstservice residential nevada,firstservice residential nevada,firstservice residential nevada,8290 arville st,False
DORADO HOMEOWNERS ASSOCIATION,1735-2005,SUB,94,(775) 853-9777,C/O TERRA WEST PROPERTY MANAGEMENT,10651 PROFESSIONAL CIR STE A,RENO,NV,89521,Washoe,terra west management service,terra west management service,terra west management service,terra west management service,6655 s cimarron rd,False
DORRELL ESTATES COMMUNITY ASSOCIATION,0172642018-7,REG,73,(702) 531-3382,C/O CAMCO,P O BOX 400518,LAS VEGAS,NV,89140,Clark,nevada community management,nevada community management,las vega valley community management,las vega valley community management,7571 tule spring rd,False
DORRELL SQUARE HOMEOWNERS ASSOCIATION,15668-2004,REG,110,(702) 247-1115,"C/O IDEAL COMMUNITY MANAGEMENT, INC.",5785 CENTENNIAL CENTER BLVD STE 210,LAS VEGAS,NV,89149,Clark,epic association management,epic association management,epic association management,epic association management,8712 spanish ridge ave,False
DORRELL SUMMIT HOMEOWNERS ASSOCIATION,0274862014-2,REG,33,(702) 531-3382,C/O CAMCO,PO BOX 400518,LAS VEGAS,NV,89140,Clark,prime community management,prime community management,prime community management,prime community management,181 n arroyo grande blvd,False
DOUBLE DIAMOND RANCH MASTER ASSOCIATION,21125-1996,MSTR,2072,(775) 853-9777,C/O TERRA WEST MANAGEMENT SERVICES,10651 PROFESSIONAL CIRCLE STE. A,RENO,NV,89521,Washoe,the management trust,the management trust,the management trust,the management trust,8485 w sunset rd,False
DOUBLE TREE HOMEOWNERS ASSOCIATION,5721-1995,REG,68,(775) 884-6176,C/O INCLINE PROPERTY MANAGEMENT,123 W. NYE LN STE 720,CARSON CITY,NV,89706,Carson City,level property management,level property management,level property management,level property management,8966 spanish ridge ave 100,False
DOVE CANYON HOMEOWNERS ASSOCIATION,8376-2001,REG,188,(702) 362-6262,C/O TERRA WEST MANAGEMENT SERVICES,PO BOX 80900,LAS VEGAS,NV,89113,Clark,howard hughe,howard hughe,howard hughe,howard hughe,10801 w charleston blvd 3rd fl,False
DRIFTWOOD BAY HOMEOWNERS ASSOCIATION,0095252014-2,REG,74,(702) 531-3382,C/O CAMCO,PO BOX 400518,LAS VEGAS,NV,89140,Clark,pinnacle community association management,pinnacle community association management,pinnacle community association management,pinnacle community association management,9330 w sahara ave,False
DUCK CREEK VILLAGE I & II HOMEOWNERS ASSOCIATION,7333-1987,REG,366,(702) 767-9993,C/O EPIC ASSOCIATION MANAGEMENT,8712 SPANISH RIDGE AVE,LAS VEGAS,NV,89148,Clark,epic association mgmt,epic association management,epic association management,epic association management,8712 spanish ridge ave,True
DUNCAN COURT HOMEOWNERS ASSOCIATION,185-1985,REG,44,(702) 990-9707,C/O HOA MANAGEMENT,6595 W. SMOKE RANCH #110,LAS VEGAS,NV,89108,Clark,complete association mgmt,camco,camco,camco,po box 400518,True
DUNEVILLE MEADOWS HOMEOWNERS ASSOCIATION,0251222018-3,REG,19,(702) 531-3382,C/O CAMCO,P O BOX 400518,LAS VEGAS,NV,89140,Clark,real propertie management group,real propertie management group,real propertie management group,real propertie management group,po box 95606,False
DURANGO RANCH HOMEOWNERS' ASSOCIATION,0012532012-5,REG,200,(702) 301-2353,C/O CANNON MANAGEMENT,7473 W LAKE MEAD BLVD STE 100,LAS VEGAS,NV,89128,Clark,adept management service,adept management service,adept management service,adept management service,5550 painted mirage rd,False
DURANGO SPRINGS II LANDSCAPE MAINTENANCE ASSOCIATION,10008-2002,REG,111,(702) 795-3344,C/O ASSOCIA NEVADA SOUTH,7670 W. LAKE MEAD BLVD STE 100,LAS VEGAS,NV,89128,Clark,terra west management service,terra west management service,terra west management service,terra west management service,6655 s cimarron rd,False
DURANGO SPRINGS LANDSCAPE MAINTENANCE ASSOCIATION,21879-2001,REG,113,(702) 222-2391,"C/O NEVADA COMMUNITY MANAGEMENT, LLC",9500 W FLAMINGO ST STE 204,LAS VEGAS,NV,89147,Clark,real propertie management group,real propertie management group,real propertie management group,real propertie management group,po box 95606,False
DURANGO TRAIL ASSEMBLAGE HOMEOWNERS' ASSOCIATION,0264782013-9,REG,200,(702) 942-2500,C/O COMMUNITY MANAGEMENT GROUP,2450 BOX CANYON DR,LAS VEGAS,NV,89128,Clark,las vega valley community management,las vega valley community management,las vega valley community management,las vega valley community management,7571 tule spring rd,False
"DURANGO TRAILS HOMEOWNERS ASSOCIATION, INC.",11538-1995,REG,278,(702) 362-0318,"C/O PERFORMANCE CAM, LLC",5135 CAMINO AL NORTE STE 100,N LAS VEGAS,NV,89031,Clark,desert hoa management,desert hoa management,desert hoa management,desert hoa management,po box 750639,False
DURANGO VALLEY ASSEMBLAGE COMMUNITY ASSOCIATION,0219112015-7,REG,80,702-531-3382,C/O CAMCO,P.O. BOX 400518,LAS VEGAS,NV,89140,Clark,prime community management,prime community management,prime community management,prime community management,181 n arroyo grande blvd,False
EAGLE CANYON ASSOCIATION,10093-1996,REG,620,(775) 852-2224,C/O EQUUS MANAGEMENT GROUP,5480 RENO CORPORATE DR STE 100,RENO,NV,89511,Washoe,bbcm,bbcm,bbcm,bbcm,5940 s rainbow blvd,False
EAGLE CANYON ESTATES ASSOCIATION,3660-2002,REG,520,(775) 284-2050,EQUUS MANAGEMENT GROUP,4888 SPARKS BLVD STE 102,SPARKS,NV,89436,Washoe,,,,,,
EAGLE CANYON HOMEOWNERS ASSOCIATION,0280632005-2,REG,29,(702) 655-7064,C/O LAS VEGAS VALLEY COMMUNITY MANAGEMENT LLC,PO BOX 750266,LAS VEGAS,NV,89136,Clark,howard hughe,howard hughe,howard hughe,howard hughe,10801 w charleston blvd 3rd fl,False
EAGLE CANYON NORTH ASSOCIATION,20958-2001,REG,510,(775) 852-2224,C/O EQUUS MANAGEMENT GROUP,5480 RENO CORPORATE DR STE 100,RENO,NV,89511,Washoe,taylor association management,taylor association management,taylor association management,taylor association management,259 n peco rd,False
EAGLE CANYON RANCH ASSOCIATION,0237412016-6,MSTR,465,(775) 626-7333,C/O ASSOCIA SIERRA NORTH-AN ASSOCIA COMPANY,10509 PROFESSIONAL CIRCLE STE 200,RENO,NV,89521,Washoe,sierra community management,sierra community management,sierra community management,sierra community management,6280 s valley view,False
EAGLE CANYON WEST HOMEOWNERS ASSOCIATION,0062472006-9,REG,28,(702) 655-7064,C/O LAS VEGAS VALLEY COMMUNITY MANAGEMENT LLC,7571 TULE SPRINGS ROAD,LAS VEGAS,NV,89131,Clark,omni community management,omni community management,omni community management,omni community management,18124 wedge parkway,False
EAGLE CREEK COMMUNITY ASSOCIATION,16580-1998,REG,106,(702) 933-7764,C/O REAL PROPERTIES MANAGEMENT GROUP INC,P O BOX 95606,LAS VEGAS,NV,89193,Clark,taylor association management,taylor association management,taylor association management,taylor association management,259 n peco rd,False
EAGLE CREEK HEIGHTS COMMUNITY ASSOCIATION,1440-1999,REG,118,(702) 754-6313,C/O SIERRA COMMUNITY MANAGEMENT,6280 S VALLEY VIEW BLVD STE 310,LAS VEGAS,NV,89118,Clark,las vega valley community management,las vega valley community management,las vega valley community management,las vega valley community management,7571 tule spring rd,False
EAGLE CREST HOMEOWNERS ASSOCIATION,0087022013-4,REG,138,(702) 515-2043,C/O THOROUGHBRED MANAGEMENT,2555 W CHEYENNE AVE,LAS VEGAS,NV,89032,Clark,community association management,community association management,community association management,community association management,333 n curry st,False
EAGLE CROSSING COMMUNITY ASSOCIATION,25099-1999,REG,137,(702) 531-3382,C/O CAMCO,PO BOX 400518,LAS VEGAS,NV,89140,Clark,firstservice residential nevada,firstservice residential nevada,firstservice residential nevada,firstservice residential nevada,8290 arville st,False
EAGLE HEIGHTS AT ELKHORN SPRINGS HOMEOWNERS ASSOCIATION INC,13065-1998,REG,81,(702) 515-2042,C/O THOROUGHBRED MANAGEMENT INC,2555 W CHEYENNE AVE,N LAS VEGAS,NV,89032,Clark,associa nevada south,associa nevada south,associa nevada south,associa nevada south,7670 w lake mead blvd,False
EAGLE HIGHLANDS OWNERS ASSOC,2029-1973,REG,96,(775) 884-6176,C/O INCLINE PROPERTY MANAGEMENT,848 TANAGER ST STE M,INCLINE VILLAGE,NV,89451,Washoe,equu management group,equu management group,equu management group,equu management group,5480 reno corporate dr,False
EAGLE HIGHLANDS PHASE II HOMEOWNERS ASSOCIATION,2540-1983,REG,92,(775) 884-6176,C/O INCLINE PROPERTY MANAGEMENT,123 W NYE LN STE 720,CARSON CITY,NV,89706,Carson City,seabreeze management,seabreeze management,seabreeze management,seabreeze management,9205 w russell rd,False
EAGLE HILLS COMMUNITY ASSOCIATION,9424-1991,SUB,158,(702) 869-0937,C/O PRIME COMMUNITY MANAGEMENT LLC,181 N ARROYO GRANDE BLVD STE 125,HENDERSON,NV,89074,Clark,camco,camco,camco,camco,p o box 400518,False
EAGLE POINT HOMEOWNERS ASSOCIATION,4938-1996,SUB,12,(702) 345-2200,C/O COLONIAL PROPERTY MANAGEMENT,736 W PIONEER BLVD STE 200,MESQUITE,NV,89027,Clark,camco,camco,camco,camco,po box 400518,False
EAGLE RANCH HOMEOWNERS ASSOCIATION,0914612005-7,REG,25,(702) 655-7064,C/O NEVADA COMMUNITY MANAGEMENT,7571 TULE SPRINGS ROAD,LAS VEGAS,NV,89131,Clark,prime community management,prime community management,prime community management,prime community management,181 n arroyo grande blvd,False
EAGLE RANCH NW HOMEOWNERS ASSOCIATION,0327842014-4,REG,70,(702) 531-3382,C/O CAMCO,PO BOX 400518,LAS VEGAS,NV,89140,Clark,associa sierra north,associa sierra north,associa sierra north,associa sierra north,10509 professional cir,False
EAGLE RIDGE AT GENOA HOMEOWNERS ASSOCIATION,0416652005-8,REG,55,(775) 884-6176,C/O INCLINE PROPERTY MANAGEMENT,"123 W. NYE LANE, STE 720",CARSON CITY,NV,89706,Carson City,equu management group,equu management group,equu management group,equu management group,5480 reno corporate dr,False
EAGLE RIDGE AT SKYE CANYON COMMUNITY ASSOCIATION,0057482018-7,SUB,102,(949) 672-9079,C/O SEABREEZE MANAGEMENT,8960 W. TROPICANA AVE.,LAS VEGAS,NV,89147,Clark,real property management group,real property management group,real propertie management group,real propertie management group,po box 95606,False
EAGLE RIDGE PROPERTY OWNERS ASSOCIATION,15666-1995,REG,44,(702) 851-7660,C/O NICKLIN PROPERTY MANAGEMENT,375 N STEPHANIE ST STE 911,HENDERSON,NV,89014,Clark,olympia management service,olympia management service,olympia management service,olympia management service,11411 southern highland pkwy,False
EAGLE ROCK HOMEOWNERS ASSOCIATION,11928-1996,SUB,143,(702) 737-8580,C/O FIRSTSERVICE RESIDENTIAL NEVADA LLC,8290 ARVILLE ST,LAS VEGAS,NV,89139,Clark,spanish trail master assn,spanish trail master assn,spanish trail master assn,spanish trail master assn,7495 mission hill dr,False
EAGLE ROCK OF MOAPA VALLEY HOME OWNER'S ASSOCIATION,0166022006-1,REG,8,(702) 281-8830,,PO BOX 375,LOGANDALE,NV,89021,Clark,,,,,,
EAGLE VALLEY DRIVE HOMEOWNERS ASSOCIATION INC,9317-1990,SUB,38,(702) 362-6262,C/O TERRA WEST MANAGEMENT SERVICES,6655 S CIMARRON RD STE 200,LAS VEGAS,NV,89113,Clark,thoroughbred management,thoroughbred management,thoroughbred management,thoroughbred management,2555 w cheyenne ave,False
EAGLE VIEW HOMEOWNERS ASSOCIATION,10119-2001,REG,124,(702) 531-3382,C/O CAMCO,PO BOX 400518,LAS VEGAS,NV,89140,Clark,community management group,community management group,community management group,community management group,2450 box canyon dr,False
EAGLE'S ROCK ESTATES HOMEOWNERS ASSOCIATION,0513292011-0,REG,9,(702) 395-2399,"C/O TRITON HOA SERVICES, LLC.",7495 W AZURE DRIVE STE 110,LAS VEGAS,NV,89130,Clark,capital consultant management,capital consultant management,capital consultant management,capital consultant management,1 via vasari,False
EAGLECREST TOWNHOMES HOMEOWNERS ASSOCIATION,29018-2003,REG,120,(702) 736-9450,C/O TAYLOR ASSOCIATION MANAGEMENT,259 N PECOS RD STE 100,HENDERSON,NV,89074,Clark,spanish trail master assn,spanish trail master assn,spanish trail master assn,spanish trail master assn,7495 w mission hill dr,False
EAGLESNEST HOMEOWNERS' ASSOCIATION,2266-1990,SUB,73,(775) 746-1499,C/O CAUGHLIN RANCH HOA,1070 CAUGLIN CROSSING,RENO,NV,89519,Washoe,eugene burger management,eugene burger management,eugene burger management,eugene burger management,po box 751330,False
EARLSTONE HOMEOWNERS ASSOCIATION,0562362005-0,SUB,98,(702) 737-8580,"C/O FIRSTSERVICE RESIDENTIAL, NEVADA, LLC",8290 ARVILLE ST,LAS VEGAS,NV,89139,Clark,thoroughbred management,thoroughbred management,thoroughbred management,thoroughbred management,2555 w cheyenne ave,False
